en_word,pos,level,mp3_url,ru_word,transcription,en_example,ru_example
withdraw,verb,b2,https://www.oxfordlearnersdictionaries.com/media/english/uk_pron/w/wit/withd/withdraw__gb_1.mp3,выводить,[wɪðˈdrɔ:],3. Press the “Withdraw” button,"3. Нажимаем кнопку ""Вывести"""
magnitude,noun,c1,https://www.oxfordlearnersdictionaries.com/media/english/uk_pron/m/mag/magni/magnitude__gb_1.mp3,величина,[ˈmæɡnɪtju:d],But the magnitude of the economic costs should not be exaggerated:,Но не стоит преувеличивать величину экономических затрат:
contend,verb,c1,https://www.oxfordlearnersdictionaries.com/media/english/uk_pron/x/xco/xcont/xcontend__gb_1.mp3,утверждать,[kənˈtend],"Others, however, contend that a flat tax is intrinsically unfair.","Другие, однако, утверждают, что пропорциональный налог - несправедливый."
suppress,verb,c1,https://www.oxfordlearnersdictionaries.com/media/english/uk_pron/s/sup/suppr/suppress__gb_1.mp3,подавлять,[səˈpres],Humans love to suppress abstract dangers.,Люди любят подавлять абстрактные угрозы.
highway,noun,b2,https://www.oxfordlearnersdictionaries.com/media/english/uk_pron/h/hig/highw/highway__gb_1.mp3,шоссе,[ˈhaɪweɪ],"Highway 50, east of Chantilly.","Шоссе 50, к востоку от Чантилли."
manufacture,verb,b2,https://www.oxfordlearnersdictionaries.com/media/english/uk_pron/m/man/manuf/manufacture__gb_3.mp3,изготовлять,[ˌmænjuˈfæktʃə],"We, uh, manufacture wooden furniture.",Мы занимается изготовлением деревянной мебели.
optimistic,adjective,b2,https://www.oxfordlearnersdictionaries.com/media/english/uk_pron/o/opt/optim/optimistic__gb_1.mp3,оптимистичный,[ˌɔptɪˈmɪstɪk],Why am I so optimistic?,Почему я настроен так оптимистично?
tablet,noun,a2,https://www.oxfordlearnersdictionaries.com/media/english/uk_pron/t/tab/table/tablet__gb_1.mp3,планшет,[ˈtæblɪt],Restart your phone or tablet,Перезапустите свой телефон или планшет.
loan,noun,b2,https://www.oxfordlearnersdictionaries.com/media/english/uk_pron/l/loa/loan_/loan__gb_2.mp3,кредиты,[ləun],Extensive loan losses have required expensive bank recapitalization operations.,Большие потери по кредитам и сделкам потребовали введения дорогостоящих банковских операций по рекапитализации.
passport,noun,a1,https://www.oxfordlearnersdictionaries.com/media/english/uk_pron/p/pas/passp/passport__gb_1.mp3,паспорт,[ˈpɑ:spɔ:t],Please have your passport ready.,"Пожалуйста, приготовьте паспорт."
large-scale,adjective,c1,https://www.oxfordlearnersdictionaries.com/media/english/uk_pron/l/lar/large/large_scale_1_gb_2.mp3,крупномасштабный,,"Local, large-scale solutions are emerging.",Появляются местные крупномасштабные решения.
patrol,noun,c1,https://www.oxfordlearnersdictionaries.com/media/english/uk_pron/p/pat/patro/patrol__gb_1.mp3,патруль,[pəˈtrəul],Neither patrol found one Kraut.,Патруль не обнаружил ни единого фрица.
terrorism,noun,b2,https://www.oxfordlearnersdictionaries.com/media/english/uk_pron/t/ter/terro/terrorism__gb_1.mp3,терроризм,[ˈterərɪzm],Terrorism is an existential threat.,Терроризм - это экзистенциальная угроза.
inspect,verb,c1,https://www.oxfordlearnersdictionaries.com/media/english/uk_pron/i/ins/inspe/inspect__gb_1.mp3,проверять,[ɪnˈspekt],Inspect the HDMI cable for damage.,Проверьте исправность HDMI-кабеля.
venue,noun,b2,https://www.oxfordlearnersdictionaries.com/media/english/uk_pron/v/ven/venue/venue__gb_1.mp3,место проведения,[ˈvenju:],Copenhagen is the venue for the meeting.,Местом проведения переговоров станет Копенгаген.
powder,noun,b1,https://www.oxfordlearnersdictionaries.com/media/english/uk_pron/p/pow/powde/powder__gb_1.mp3,порошок,[ˈpaudə],Sounds like a washing powder.,Звучит как стиральный порошок.
alien,adjective,c1,https://www.oxfordlearnersdictionaries.com/media/english/uk_pron/a/ali/alien/alien__gb_2.mp3,иностранный,[ˈeɪljən],The alien tort statute allows foreign nationals to bring civil claims in U S court.,Закон об иностранных деликтных исках позволяет иностранцам подавать гражданские иски в суд США.
singer,noun,a1,https://www.oxfordlearnersdictionaries.com/media/english/uk_pron/s/sin/singe/singer__gb_2.mp3,певец,[ˈsɪŋə],The popular singer committed suicide.,Популярный певец покончил жизнь самоубийством.
deck,noun,b2,https://www.oxfordlearnersdictionaries.com/media/english/uk_pron/d/dec/deck_/deck__gb_1.mp3,палуба,[dek],"Security, seal the Engineering Deck.","Охрана, изолируйте Инженерную Палубу."
ironic,adjective,c1,https://www.oxfordlearnersdictionaries.com/media/english/uk_pron/i/iro/ironi/ironic__gb_1.mp3,ироничный,[aɪˈrɔnɪk],It would be an ironic turn of events.,Довольно ироничный поворот событий.
erect,verb,c1,https://www.oxfordlearnersdictionaries.com/media/english/uk_pron/e/ere/erect/erect__gb_1.mp3,воздвигать,[ɪˈrekt],"Sometimes, new monuments are erected.",Иногда воздвигают новые памятники.
compose,verb,b2,https://www.oxfordlearnersdictionaries.com/media/english/uk_pron/c/com/compo/compose__gb_1.mp3,составлять,[kəmˈpəuz],"Compose your message, and then send it.","Составьте сообщение, а затем отправьте его."
request,noun,a2,https://www.oxfordlearnersdictionaries.com/media/english/uk_pron/r/req/reque/request__gb_1.mp3,просьба,[rɪˈkwest],She turned down my request.,Она отклонила мою просьбу.
province,noun,c1,https://www.oxfordlearnersdictionaries.com/media/english/uk_pron/p/pro/provi/province__gb_1.mp3,провинция,[ˈprɔvɪns],Natural variability in nodule province ecosystems.,естественная изменчивость экосистем конкрециеносных провинций.
hope,noun,a2,https://www.oxfordlearnersdictionaries.com/media/english/uk_pron/h/hop/hope_/hope__gb_1.mp3,надежда,[həup],"You must have hope, satine.","Не теряйте надежды, Сатин."
discharge,verb,c1,https://www.oxfordlearnersdictionaries.com/media/english/uk_pron/d/dis/disch/discharge__gb_1.mp3,выписывать,['dɪskɑːd],The patient in Ward 3 requested to be discharge.,Пациента в 3 палате можно выписать.
commission,noun,b2,https://www.oxfordlearnersdictionaries.com/media/english/uk_pron/c/com/commi/commission__gb_2.mp3,комиссия,[kəˈmɪʃən],no commission Company's events,отсутствие комиссии
mean,verb,a1,https://www.oxfordlearnersdictionaries.com/media/english/uk_pron/m/mea/mean_/mean__gb_2.mp3,означать,[mi:n],Now what could this mean?,Что это может означать?
landscape,noun,b2,https://www.oxfordlearnersdictionaries.com/media/english/uk_pron/l/lan/lands/landscape__gb_1.mp3,ландшафт,[ˈlænskeɪp],on Nature and Landscape Protection.,об охране природы и ландшафтов.
muscle,noun,b1,https://www.oxfordlearnersdictionaries.com/media/english/uk_pron/m/mus/muscl/muscle__gb_1.mp3,мышца,[ˈmʌsl],"Yeah, the left trapezius muscle.","Да, это - левая трапециевидная мышца."
terminate,verb,c1,https://www.oxfordlearnersdictionaries.com/media/english/uk_pron/t/ter/termi/terminate__gb_3.mp3,завершать,[ˈtə:mɪneɪt],If you terminate the session here,Место завершения сеанса
emphasize,verb,b2,https://www.oxfordlearnersdictionaries.com/media/english/uk_pron/e/emp/empha/emphasize__gb_2.mp3,подчеркивать,[ˈemfəsaɪz],You should emphasize that fact.,Тебе стоит подчеркнуть этот факт.
administrative,adjective,c1,https://www.oxfordlearnersdictionaries.com/media/english/uk_pron/a/adm/admin/administrative__gb_1.mp3,административный,[ədˈmɪnɪstrətɪv],"General, marketing, and administrative costs","Общие, сбытовые и административные издержки"
globe,noun,b2,https://www.oxfordlearnersdictionaries.com/media/english/uk_pron/g/glo/globe/globe__gb_1.mp3,земной шар,[ˈɡləub],"Of course, weak points abound all over the globe.","Конечно, слабых в экономическом отношении мест на земном шаре вполне достаточно."
barrier,noun,b2,https://www.oxfordlearnersdictionaries.com/media/english/uk_pron/b/bar/barri/barrier__gb_2.mp3,барьер,[ˈbærɪə],Finance is another great barrier.,Другим большим барьером является финансирование.
guilty,adjective,b1,https://www.oxfordlearnersdictionaries.com/media/english/uk_pron/g/gui/guilt/guilty__gb_2.mp3,виновный,[ˈɡɪltɪ],He has pleaded not guilty.,Он не признал себя виновным.
spot,noun,b1,https://www.oxfordlearnersdictionaries.com/media/english/uk_pron/s/spo/spot_/spot__gb_1.mp3,место,[spɔt],He consented on the spot.,Он согласился на месте.
type,noun,a1,https://www.oxfordlearnersdictionaries.com/media/english/uk_pron/t/typ/type_/type__gb_2.mp3,тип,[taɪp],Set up a calculation type.,Укажите тип расчетов.
whip,verb,c1,https://www.oxfordlearnersdictionaries.com/media/english/uk_pron/w/whi/whip_/whip__gb_1.mp3,взбивать,[wɪp],"Can I get some whip cream, please?","Можно мне еще взбитых сливок, пожалуйста?"
important,adjective,a1,https://www.oxfordlearnersdictionaries.com/media/english/uk_pron/i/imp/impor/important__gb_2.mp3,важный,[ɪmˈpɔ:tənt],That's understandable and important.,И это понятно и очень важно.
sacred,adjective,c1,https://www.oxfordlearnersdictionaries.com/media/english/uk_pron/s/sac/sacre/sacred__gb_1.mp3,священный,[ˈseɪkrɪd],The Sacred Rules of War,Священные правила войны
sophisticated,adjective,b2,https://www.oxfordlearnersdictionaries.com/media/english/uk_pron/s/sop/sophi/sophisticated__gb_1.mp3,сложный,[səˈfɪstɪkeɪtɪd],We have a sophisticated alarm system.,У нас сложная система сигнализации.
dominant,adjective,b2,https://www.oxfordlearnersdictionaries.com/media/english/uk_pron/d/dom/domin/dominant__gb_1.mp3,доминирующий,[ˈdɔmɪnənt],"Currently, the US dollar remains dominant.",В настоящее время американский доллар остается доминирующим.
minute,adjective,c1,https://www.oxfordlearnersdictionaries.com/media/english/uk_pron/m/min/minut/minute__gb_2.mp3,точный,['mɪnɪt],,
inner,adjective,b2,https://www.oxfordlearnersdictionaries.com/media/english/uk_pron/i/inn/inner/inner__gb_1.mp3,внутренний,[ˈɪnə],Most joins are inner joins.,Большинство соединений являются внутренними.
transform,verb,b2,https://www.oxfordlearnersdictionaries.com/media/english/uk_pron/t/tra/trans/transform__gb_3.mp3,преобразовывать,[trænsˈfɔ:m],Automatically transform your drawings into shapes.,Рисунки теперь можно автоматически преобразовывать в фигуры.
palm,noun,b2,https://www.oxfordlearnersdictionaries.com/media/english/uk_pron/p/pal/palm_/palm__gb_1.mp3,пальма,[pɑ:m],Restocking destroyed date palm plantations.,восстановление уничтоженных плантаций финиковых пальм.
settler,noun,b2,https://www.oxfordlearnersdictionaries.com/media/english/uk_pron/s/set/settl/settler__gb_1.mp3,поселенец,[ˈsetlə],"26 Source: interview with Arale Tsur, Chairman of the Hof Aza [settler] Regional Council, 27 February 2000.","26 Источник: интервью с Председателем Регионального совета Хоф Аза [поселенцев] г-ном Арале Цуре, 27 февраля 2000 года"
temperature,noun,a2,https://www.oxfordlearnersdictionaries.com/media/english/uk_pron/t/tem/tempe/temperature__gb_1.mp3,температура,[ˈtemprɪtʃə],Do you have a temperature?,У вас температура?
wine,noun,a1,https://www.oxfordlearnersdictionaries.com/media/english/uk_pron/w/win/wine_/wine__gb_1.mp3,вино,[waɪn],This is wild ginseng wine.,Это вино из дикого женьшеня.
equip,verb,b2,https://www.oxfordlearnersdictionaries.com/media/english/uk_pron/e/equ/equip/equip__gb_1.mp3,оснащать,[ɪˈkwɪp],Establish and equip an alternate data centre outside New York for disaster recovery;,создать и оснастить альтернативный центр данных за пределами Нью-Йорка для аварийного восстановления данных;
capital,adjective,a1,https://www.oxfordlearnersdictionaries.com/media/english/uk_pron/c/cap/capit/capital__gb_1.mp3,капитальный,[ˈkæpɪtl],Reserve for capital asset fund,Резерв для фонда капитальных активов
reside,verb,c1,https://www.oxfordlearnersdictionaries.com/media/english/uk_pron/r/res/resid/reside__gb_1.mp3,проживать,[rɪˈzaɪd],"Mr. Boday, where do you reside?","Мистер Бодай, где вы проживаете?"
mate,noun,b2,https://www.oxfordlearnersdictionaries.com/media/english/uk_pron/m/mat/mate_/mate__gb_1.mp3,приятель,[meɪt],"No, mate, just me civvies.","Нет, приятель, я в штатском."
flesh,noun,c1,https://www.oxfordlearnersdictionaries.com/media/english/uk_pron/f/fle/flesh/flesh__gb_1.mp3,плоть,[fleʃ],Jeremy Danvers in the flesh.,Джереми Денверс во плоти.
wipe,verb,c1,https://www.oxfordlearnersdictionaries.com/media/english/uk_pron/w/wip/wipe_/wipe__gb_1.mp3,вытирать,[waɪp],Wipe up your baby with Ajax!,Вытирайте ребенка салфетками Ajax!
helmet,noun,b2,https://www.oxfordlearnersdictionaries.com/media/english/uk_pron/h/hel/helme/helmet__gb_1.mp3,шлем,[ˈhelmɪt],Are you in a helmet?,Вы используете шлем?
cruise,noun,b2,https://www.oxfordlearnersdictionaries.com/media/english/uk_pron/c/cru/cruis/cruise__gb_1.mp3,круизный,[kru:z],"Special international venues, such as airplanes and cruise ships","Специализированный международный транспорт (например, самолеты и круизные суда)"
cancer,noun,b2,https://www.oxfordlearnersdictionaries.com/media/english/uk_pron/c/can/cance/cancer__gb_2.mp3,рак,[ˈkænsə],My uncle died of cancer.,Мой дядя умер от рака.
available,adjective,a2,https://www.oxfordlearnersdictionaries.com/media/english/uk_pron/a/ava/avail/available__gb_2.mp3,доступный,[əˈveɪləbl],Roles available for ad accounts,"Роли, доступные для рекламных аккаунтов"
placement,noun,b2,https://www.oxfordlearnersdictionaries.com/media/english/uk_pron/p/pla/place/placement__gb_1.mp3,плейсмент,[ˈpleɪsmənt],Scroll to the Placement section.,Прокрутите страницу до раздела Плейсмент.
bass,noun,c1,https://www.oxfordlearnersdictionaries.com/media/english/uk_pron/b/bas/bass_/bass__gb_1.mp3,бас,[bæs],He plays the bass now.,Он сейчас играет на басу.
maintain,verb,b2,https://www.oxfordlearnersdictionaries.com/media/english/uk_pron/m/mai/maint/maintain__gb_3.mp3,поддерживать,[meɪnˈteɪn],Greenhouses could maintain plant life.,Оранжереи можно поддерживать жизнь растений.
management,noun,b1,https://www.oxfordlearnersdictionaries.com/media/english/uk_pron/m/man/manag/management__gb_2.mp3,управление,[ˈmænɪdʒmənt],Azure Rights Management connector connector,Соединитель Соединитель управления правами Azure
ambassador,noun,c1,https://www.oxfordlearnersdictionaries.com/media/english/uk_pron/a/amb/ambas/ambassador__gb_1.mp3,посол,[æmˈbæsədə],"Ambassador Extraordinary and Plenipotentiary, 1981.","Чрезвычайный и Полномочный Посол, 1981 год"
increase,noun,a2,https://www.oxfordlearnersdictionaries.com/media/english/uk_pron/i/inc/incre/increase__gb_3.mp3,увеличение,['ɪnkriːs],Increase the letter of guarantee value,Увеличение суммы гарантийного письма
accusation,noun,c1,https://www.oxfordlearnersdictionaries.com/media/english/uk_pron/a/acc/accus/accusation__gb_1.mp3,обвинение,[ˌækju:ˈzeɪʃən],This is not an accusation.,Это не обвинение.
liberation,noun,c1,https://www.oxfordlearnersdictionaries.com/media/english/uk_pron/l/lib/liber/liberation__gb_1.mp3,освобождение,,"Liberation, however, costs some money.","Освобождение, несмотря на это, кое-чего стоит."
spiritual,adjective,b2,https://www.oxfordlearnersdictionaries.com/media/english/uk_pron/s/spi/spiri/spiritual__gb_1.mp3,духовный,[ˈspɪrɪtjuəl],It is a spiritual experience.,Это духовный опыт.
aggressive,adjective,b2,https://www.oxfordlearnersdictionaries.com/media/english/uk_pron/a/agg/aggre/aggressive__gb_2.mp3,агрессивный,[əˈɡresɪv],Cypher beetles aren't aggressive.,Шифровальные жуки не агрессивны.
overwhelming,adjective,c1,https://www.oxfordlearnersdictionaries.com/media/english/uk_pron/o/ove/overw/overwhelming__gb_3.mp3,подавляющий,[ˌəuvəˈwelmɪŋ],It can also call in overwhelming air power.,Она может также создать подавляющее превосходство в авиации.
associated,adjective,b2,https://www.oxfordlearnersdictionaries.com/media/english/uk_pron/a/ass/assoc/associated__gb_2.mp3,связанный,[əˈsəuʃɪeɪtɪd],Your bookmarks' associated thumbnail images,Связанные с закладками изображения эскизов
embrace,verb,b2,https://www.oxfordlearnersdictionaries.com/media/english/uk_pron/e/emb/embra/embrace__gb_1.mp3,принимать,[ɪmˈbreɪs],"Second, embrace the ambition of others.","Во-вторых, необходимо принимать амбиции окружающих."
remains,noun,c1,https://www.oxfordlearnersdictionaries.com/media/english/uk_pron/r/rem/remai/remains__gb_1.mp3,останки,[rɪˈmeɪnz],Forensic medical examination of the remains;,проведение судебно-медицинской экспертизы останков;
conversion,noun,c1,https://www.oxfordlearnersdictionaries.com/media/english/uk_pron/x/xco/xconv/xconversion__gb_1.mp3,конверсия,,Conversion values in custom conversions,Ценность конверсии в индивидуально настроенных конверсиях
rare,adjective,b1,https://www.oxfordlearnersdictionaries.com/media/english/uk_pron/r/rar/rare_/rare__gb_1.mp3,редкий,[rɛə],Sourcing and supplying rare collectables.,Занимался поставками редких предметов коллекционирования.
cue,noun,b2,https://www.oxfordlearnersdictionaries.com/media/english/uk_pron/c/cue/cue__/cue__gb_1.mp3,сигнал,[kju:],"That's your cue to come back out here and pull that fire alarm, got it?","Это будет сигналом для тебя вернуться сюда и дернуть пожарную сигнализацию, понял?"
vein,noun,c1,https://www.oxfordlearnersdictionaries.com/media/english/uk_pron/v/vei/vein_/vein__gb_1.mp3,вена,[veɪn],"Here, pinch off this vein.","Здесь, зажми эту вену."
immediate,adjective,b1,https://www.oxfordlearnersdictionaries.com/media/english/uk_pron/i/imm/immed/immediate__gb_1.mp3,немедленный,[ɪˈmi:djət],We should take immediate action,Мы должны принять немедленные меры
constitution,noun,c1,https://www.oxfordlearnersdictionaries.com/media/english/uk_pron/x/xco/xcons/xconstitution__gb_2.mp3,конституция,[ˌkɔnstɪˈtju:ʃən],The EU Constitution Can Work,Конституцию ЕС можно привести в действие
destination,noun,b1,https://www.oxfordlearnersdictionaries.com/media/english/uk_pron/d/des/desti/destination__gb_2.mp3,назначение,[ˌdestɪˈneɪʃən],C & F station of destination.,Станция назначения франко (бесплатно).
surveillance,noun,c1,https://www.oxfordlearnersdictionaries.com/media/english/uk_pron/s/sur/surve/surveillance__gb_1.mp3,наблюдение,[sə:ˈveɪləns],Surveillance will not be easy.,Наблюдение будет не легким.
treasure,noun,b2,https://www.oxfordlearnersdictionaries.com/media/english/uk_pron/t/tre/treas/treasure__gb_1.mp3,сокровище,[ˈtreʒə],She's a treasure hunter.,Охотница за сокровищами.
newspaper,noun,a1,https://www.oxfordlearnersdictionaries.com/media/english/uk_pron/n/new/newsp/newspaper__gb_1.mp3,газета,[ˈnju:sˌpeɪpə],He was reading a newspaper.,Он читал газету.
bureaucracy,noun,c1,https://www.oxfordlearnersdictionaries.com/media/english/uk_pron/b/bur/burea/bureaucracy__gb_1.mp3,бюрократия,[bjuəˈrɔkrəsɪ],Only the power bureaucracy mattered.,Значение имела лишь власть бюрократии.
evil,adjective,b2,https://www.oxfordlearnersdictionaries.com/media/english/uk_pron/e/evi/evil_/evil__gb_1.mp3,злой,[ˈi:vl],That was an evil bunny.,Это был злой кролик.
borrow,verb,a2,https://www.oxfordlearnersdictionaries.com/media/english/uk_pron/b/bor/borro/borrow__gb_2.mp3,заимствовать,[ˈbɔrəu],"Today, sovereigns are more often democratically elected governments, but they still borrow.","Сегодня в основном правят демократически избранные правительства, однако они по-прежнему заимствуют."
penalty,noun,b2,https://www.oxfordlearnersdictionaries.com/media/english/uk_pron/p/pen/penal/penalty__gb_1.mp3,наказание,[ˈpenltɪ],And they suffer the same penalty.,И они потерпят то же наказание.
present,adjective,a1,https://www.oxfordlearnersdictionaries.com/media/english/uk_pron/p/pre/prese/present__gb_4.mp3,настоящий,['prez(ə)nt],"Live in the present, dammit!","Живи настоящим, наконец!"
copper,noun,c1,https://www.oxfordlearnersdictionaries.com/media/english/uk_pron/c/cop/coppe/copper__gb_1.mp3,медь,[ˈkɔpə],"Looks like pure copper, though.","Разве что, что он выглядит как чистая медь."
precedent,noun,c1,https://www.oxfordlearnersdictionaries.com/media/english/uk_pron/p/pre/prece/precedent__gb_1.mp3,прецедент,[ˈpresɪdənt],Russia and the Precedent Problem,Россия и проблема прецедента
conserve,verb,c1,https://www.oxfordlearnersdictionaries.com/media/english/uk_pron/x/xco/xcons/xconserve__gb_3.mp3,сохранять,[kənˈsə:v],You'll notice I'm giving less updates to conserve battery power.,"Можно заметить, что я делаю меньше заметок для сохранения заряда."
learning,noun,a2,https://www.oxfordlearnersdictionaries.com/media/english/uk_pron/l/lea/learn/learning__gb_1.mp3,обучение,[ˈlə:nɪŋ],My subject today is learning.,Моя тема на сегодня - обучение.
predecessor,noun,c1,https://www.oxfordlearnersdictionaries.com/media/english/uk_pron/p/pre/prede/predecessor__gb_1.mp3,предшественник,[ˈpri:dɪsesə],Housemaid to 51's predecessor.,Прислугу предшественника 51-го в Люксембурге.
technical,adjective,b1,https://www.oxfordlearnersdictionaries.com/media/english/uk_pron/t/tec/techn/technical__gb_2.mp3,технический,[ˈteknɪkəl],Technical analysis using Japanese candlesticks,Технический анализ японских свечей
grasp,noun,c1,https://www.oxfordlearnersdictionaries.com/media/english/uk_pron/g/gra/grasp/grasp__gb_1.mp3,схватывание,[ɡrɑ:sp],A cursory grasp of basic theology and double Dutch Latin.,Поверхностное схватывание основ богословия и тарабарская латынь.
appearance,noun,a2,https://www.oxfordlearnersdictionaries.com/media/english/uk_pron/a/app/appea/appearance__gb_1.mp3,вид,[əˈpɪərəns],"Under ""Appearance,"" click Get themes.","В разделе ""Внешний вид"" нажмите Выбрать тему."
warrant,noun,c1,https://www.oxfordlearnersdictionaries.com/media/english/uk_pron/w/war/warra/warrant__gb_1.mp3,ордер,[ˈwɔrənt],The warrant was for vagrancy?,Ордер выдан за бродяжничество?
