en_word,pos,level,mp3_url,ru_word,transcription,en_example,ru_example
move,noun,b1,https://www.oxfordlearnersdictionaries.com/media/english/uk_pron/m/mov/move_/move__gb_1.mp3,шаг,[mu:v],This was a smart move.,Это был очень разумный шаг.
utilize,verb,c1,https://www.oxfordlearnersdictionaries.com/media/english/uk_pron/u/uti/utili/utilize__gb_3.mp3,использовать,[ˈju:tɪlaɪz],Who will control and utilize them?,Кто будет ими распоряжаться и использовать их?
edition,noun,b2,https://www.oxfordlearnersdictionaries.com/media/english/uk_pron/e/edi/editi/edition__gb_1.mp3,издание,[ɪˈdɪʃən],Revised edition of the manifesto?,Исправленное издание манифеста?
global,adjective,b1,https://www.oxfordlearnersdictionaries.com/media/english/uk_pron/g/glo/globa/global__gb_2.mp3,глобальный,[ˈɡləubəl],Global production is rapidly increasing.,Его глобальное производство увеличивается быстрыми темпами.
round,adjective,a2,https://www.oxfordlearnersdictionaries.com/media/english/uk_pron/r/rou/round/round__gb_1.mp3,круглый,[raund],"Round, common, boring, soft line.","Круглый, неинтересный, скучный, мягкие линии."
county,noun,b2,https://www.oxfordlearnersdictionaries.com/media/english/uk_pron/c/cou/count/county__gb_1.mp3,округ,[ˈkauntɪ],"Three years ago, Dade County.","Три года назад, округ Дейд."
optimism,noun,c1,https://www.oxfordlearnersdictionaries.com/media/english/uk_pron/o/opt/optim/optimism__gb_1.mp3,оптимизм,[ˈɔptɪmɪzm],But this optimism is misplaced.,Но этот оптимизм необоснован.
extent,noun,b2,https://www.oxfordlearnersdictionaries.com/media/english/uk_pron/e/ext/exten/extent__gb_1.mp3,степень,[ɪksˈtent],"The strategy worked, to some extent.","В какой-то степени, эта стратегия работала."
propose,verb,b2,https://www.oxfordlearnersdictionaries.com/media/english/uk_pron/p/pro/propo/propose__gb_2.mp3,предлагать,[prəˈpəuz],"Instead, I propose a toast.","Вместо этого, Я предлагаю тост."
critique,noun,c1,https://www.oxfordlearnersdictionaries.com/media/english/uk_pron/c/cri/criti/critique__gb_2.mp3,критический анализ,[krɪˈti:k],"But many in China, from nationalist bloggers to social justice activists, advance a deeper critique of the Leviathan reserve.","Однако многие китайцы, от националистических блоггеров, до активистов социальной справедливости, подвергают левиафановские запасы более глубокому критическому анализу."
penny,noun,a2,https://www.oxfordlearnersdictionaries.com/media/english/uk_pron/p/pen/penny/penny__gb_1.mp3,пенс,[ˈpenɪ],"Pence responded, “No, we haven’t.”","Пенс ответил: «Нет, не называли»."
state,adjective,b1,https://www.oxfordlearnersdictionaries.com/media/english/uk_pron/s/sta/state/state__gb_2.mp3,государственный,[steɪt],"State revoke your license, yet?","Государственный отозвать лицензию, еще?"
sketch,noun,c1,https://www.oxfordlearnersdictionaries.com/media/english/uk_pron/s/ske/sketc/sketch__gb_1.mp3,набросок,[sketʃ],Make a sketch of her abductors.,Сделайте набросок её похитителей.
fever,noun,b2,https://www.oxfordlearnersdictionaries.com/media/english/uk_pron/f/fev/fever/fever__gb_1.mp3,лихорадка,[ˈfi:və],"Confusion, fever, photophobia, neck rigidity.","Спутанность сознания, лихорадка, светобоязнь, оцепенелость шейных мышц."
compulsory,adjective,b2,https://www.oxfordlearnersdictionaries.com/media/english/uk_pron/c/com/compu/compulsory__gb_1.mp3,обязательный,[kəmˈpʌlsərɪ],Byline is a compulsory element.,Байлайн — это обязательный элемент.
depth,noun,b2,https://www.oxfordlearnersdictionaries.com/media/english/uk_pron/d/dep/depth/depth__gb_1.mp3,глубина,[depθ],Level II market depth available,Доступна глубина рынка ІІ уровня
adaptation,noun,c1,https://www.oxfordlearnersdictionaries.com/media/english/uk_pron/a/ada/adapt/adaptation__gb_1.mp3,адаптация,[ˌædæpˈteɪʃən],Adaptation programs help strengthen climate resilience.,Программы по адаптации помогают укрепить климатическую устойчивость.
ghost,noun,b1,https://www.oxfordlearnersdictionaries.com/media/english/uk_pron/g/gho/ghost/ghost__gb_1.mp3,призрак,[ɡəust],Holy Ghost on a bicycle.,Святой призрак на байке.
interpretation,noun,b2,https://www.oxfordlearnersdictionaries.com/media/english/uk_pron/i/int/inter/interpretation__gb_1.mp3,толкование,[ɪnˌtə:prɪˈteɪʃən],The passage admits of no other interpretation.,Событие не допускало иного толкования.
procedure,noun,b2,https://www.oxfordlearnersdictionaries.com/media/english/uk_pron/p/pro/proce/procedure__gb_3.mp3,процедура,[prəˈsi:dʒə],Draft sampling and inspection procedure,Проект процедуры отбора проб и инспекции
landlord,noun,c1,https://www.oxfordlearnersdictionaries.com/media/english/uk_pron/l/lan/landl/landlord__gb_1.mp3,владелец,[ˈlænlɔ:d],Landlord found the body five days later.,Через пять дней владелец дома обнаружил тело.
male,adjective,a2,https://www.oxfordlearnersdictionaries.com/media/english/uk_pron/m/mal/male_/male__gb_1.mp3,мужской,,Feminism and the Male Brain,Феминизм и мужские мозги
sweet,adjective,a2,https://www.oxfordlearnersdictionaries.com/media/english/uk_pron/s/swe/sweet/sweet__gb_1.mp3,сладкий,[swi:t],The coffee is too sweet,Кофе слишком сладкий
psychologist,noun,b2,https://www.oxfordlearnersdictionaries.com/media/english/uk_pron/p/psy/psych/psychologist__gb_1.mp3,психолог,[saɪˈkɔlədʒɪst],I'm a social psychologist.,Я социальный психолог.
phrase,noun,a1,https://www.oxfordlearnersdictionaries.com/media/english/uk_pron/p/phr/phras/phrase__gb_1.mp3,фраза,[freɪz],"Highlight a word, phrase, or image.","Выделите слово, фразу или изображение."
decisive,adjective,c1,https://www.oxfordlearnersdictionaries.com/media/english/uk_pron/d/dec/decis/decisive__gb_1.mp3,решающий,[dɪˈsaɪsɪv],Who scored the decisive goal?,Кто забил решающий гол?
cake,noun,a1,https://www.oxfordlearnersdictionaries.com/media/english/uk_pron/c/cak/cake_/cake__gb_2.mp3,торт,[keɪk],Now it was your cake.,Вот теперь это был ваш торт.
shirt,noun,a1,https://www.oxfordlearnersdictionaries.com/media/english/uk_pron/s/shi/shirt/shirt__gb_2.mp3,рубашка,[ʃə:t],And tuck that shirt in.,И заправляют ту рубашку.
airport,noun,a1,https://www.oxfordlearnersdictionaries.com/media/english/uk_pron/a/air/airpo/airport__gb_3.mp3,аэропорт,[ˈɛəpɔ:t],Joan Winfield stolen at airport!,Джоан Винфилд похищена в аэропорту!
heal,verb,b2,https://www.oxfordlearnersdictionaries.com/media/english/uk_pron/h/hea/heal_/heal__gb_1.mp3,залечивать,[hi:l],Can the Democrats and Republicans Heal Themselves?,Смогут ли демократы и республиканцы залечить свои раны?
mental,adjective,b1,https://www.oxfordlearnersdictionaries.com/media/english/uk_pron/m/men/menta/mental__gb_2.mp3,психический,,It lists every known mental disorder.,В ней перечислены все известные психические заболевания.
rebuild,verb,b2,https://www.oxfordlearnersdictionaries.com/media/english/uk_pron/r/reb/rebui/rebuild__gb_1.mp3,восстанавливать,[ˈri:ˈbɪld],How to Rebuild Eastern Ukraine,Как восстановить Восточную Украину
horror,noun,b1,https://www.oxfordlearnersdictionaries.com/media/english/uk_pron/h/hor/horro/horror__gb_2.mp3,ужас,[ˈhɔrə],The Rocky Horror Picture Show.,Шоу ужасов Рокки Хоррора.
true,adjective,a1,https://www.oxfordlearnersdictionaries.com/media/english/uk_pron/t/tru/true_/true__gb_1.mp3,истинный,[tru:],Our true nationality is mankind.,Наша истинная национальность - человеческий род.
church,noun,a2,https://www.oxfordlearnersdictionaries.com/media/english/uk_pron/c/chu/churc/church__gb_1.mp3,церковь,[tʃə:tʃ],"So, go after the church.",Поэтому он и идет против церкви.
standard,adjective,b1,https://www.oxfordlearnersdictionaries.com/media/english/uk_pron/s/sta/stand/standard__gb_1.mp3,стандартный,[ˈstændəd],It's fairly standard equipment.,Вполне стандартное оборудование.
endure,verb,c1,https://www.oxfordlearnersdictionaries.com/media/english/uk_pron/e/end/endur/endure__gb_1.mp3,переживать,[ɪnˈdjuə],Argentines are left to endure wretched hours languishing in economic and political chaos.,"Аргентинцы предоставлены сами себе и вынуждены переживать мучительное время, постепенно теряя силы в продолжающемся экономическом и политическом хаосе."
nursery,noun,c1,https://www.oxfordlearnersdictionaries.com/media/english/uk_pron/n/nur/nurse/nursery__gb_1.mp3,детский,[ˈnə:sərɪ],The nursery toilet door was shut.,Дверь в туалет в детской была закрыта.
intensity,noun,c1,https://www.oxfordlearnersdictionaries.com/media/english/uk_pron/i/int/inten/intensity__gb_1.mp3,интенсивность,[ɪnˈtensɪtɪ],"Eradicator detachment, one charge, maximum intensity.","Отряд ликвидатора, один заряд, максимальная интенсивность."
deal,noun,b1,https://www.oxfordlearnersdictionaries.com/media/english/uk_pron/d/dea/deal_/deal__gb_1.mp3,сделка,[di:l],"Minimum Deal Size: $100,000",Минимальный размер сделки: 100 000$
care,noun,a2,https://www.oxfordlearnersdictionaries.com/media/english/uk_pron/c/car/care_/care__gb_1.mp3,уход,[kɛə],Engineering Better Refugee Health Care,Инженеры могут улучшить медицинский уход за беженцами
history,noun,a1,https://www.oxfordlearnersdictionaries.com/media/english/uk_pron/h/his/histo/history__gb_3.mp3,история,[ˈhɪstərɪ],The little slut's history.,История маленькой развратницы.
grip,noun,c1,https://www.oxfordlearnersdictionaries.com/media/english/uk_pron/g/gri/grip_/grip__gb_1.mp3,власть,[ɡrɪp],"indeed, they are said to be in the grip of superstition.","в действительности, говорят, что они находятся во власти предрассудков."
expression,noun,a2,https://www.oxfordlearnersdictionaries.com/media/english/uk_pron/e/exp/expre/expression__gb_1.mp3,выражение,,"Then, select Fields > Modify Expression.",Затем на вкладке Поля нажмите кнопку Изменить выражение.
speak,verb,a1,https://www.oxfordlearnersdictionaries.com/media/english/uk_pron/s/spe/speak/speak__gb_1.mp3,говорить,[spi:k],"Let's speak frankly, professor.","Давайте говорить прямо, профессор."
measure,noun,b1,https://www.oxfordlearnersdictionaries.com/media/english/uk_pron/m/mea/measu/measure__gb_3.mp3,мера,[ˈmeʒə],Measure 3.7 Deferred payment,Мера 3.7 Отсрочка платежа
pitch,noun,b2,https://www.oxfordlearnersdictionaries.com/media/english/uk_pron/p/pit/pitch/pitch__gb_1.mp3,поле,[pɪtʃ],I booked the pitch for Gryffindor today.,Я заказал поле для Гриффиндора на сегодня.
revival,noun,c1,https://www.oxfordlearnersdictionaries.com/media/english/uk_pron/r/rev/reviv/revival__gb_1.mp3,возрождение,[rɪˈvaɪvəl],But the WTO’s revival will not happen automatically.,"Впрочем, возрождение ВТО не произойдёт автоматически."
rocket,noun,b2,https://www.oxfordlearnersdictionaries.com/media/english/uk_pron/r/roc/rocke/rocket__gb_1.mp3,ракета,[ˈrɔkɪt],The Improved Cold War Rocket:,Усовершенствованная ракета холодной войны.
beneficiary,noun,c1,https://www.oxfordlearnersdictionaries.com/media/english/uk_pron/b/ben/benef/beneficiary__gb_1.mp3,бенефициар,[ˌbenɪˈfɪʃərɪ],Beneficiary: ActivTrades PLC - Client Account,Бенефициар: ActivTrades PLC Client Account
inspector,noun,b2,https://www.oxfordlearnersdictionaries.com/media/english/uk_pron/i/ins/inspe/inspector__gb_1.mp3,инспектор,[ɪnˈspektə],"It's inspector Russi, commissioner.","Это инспектор Русси, комиссар."
advertising,noun,a2,https://www.oxfordlearnersdictionaries.com/media/english/uk_pron/a/adv/adver/advertising__gb_1.mp3,реклама,,Grow your business with advertising,Развивайте свою компанию с помощью рекламы
equivalent,adjective,b2,https://www.oxfordlearnersdictionaries.com/media/english/uk_pron/e/equ/equiv/equivalent__gb_2.mp3,эквивалентный,[ɪˈkwɪvələnt],This is equivalent to foreign-currency debt.,Это эквивалентно задолженности в иностранной валюте.
possibility,noun,a2,https://www.oxfordlearnersdictionaries.com/media/english/uk_pron/p/pos/possi/possibility__gb_1.mp3,возможность,[ˌpɔsəˈbɪlɪtɪ],This is again a possibility.,Это еще одна возможность.
representation,noun,c1,https://www.oxfordlearnersdictionaries.com/media/english/uk_pron/r/rep/repre/representation__gb_1.mp3,представительство,[ˌreprɪzenˈteɪʃən],Sole and exclusive representation free.,Мы предоставляем эксклюзивное представительство.
disadvantage,noun,b1,https://www.oxfordlearnersdictionaries.com/media/english/uk_pron/d/dis/disad/disadvantage__gb_2.mp3,недостаток,[ˌdɪsədˈvɑ:ntɪdʒ],Mechanical trading systems do not suffer from this disadvantage.,Механические торговые системы лишены этого недостатка.
adult,adjective,a2,https://www.oxfordlearnersdictionaries.com/media/english/uk_pron/a/adu/adult/adult__gb_3.mp3,взрослый,[ˈædʌlt],Escort Services and Adult Dating,Эскорт-услуги и знакомства для взрослых
blank,adjective,a2,https://www.oxfordlearnersdictionaries.com/media/english/uk_pron/b/bla/blank/blank__gb_1.mp3,пустой,[blæŋk],First select some blank cells.,Сначала выделите пустые ячейки.
ruling,noun,c1,https://www.oxfordlearnersdictionaries.com/media/english/uk_pron/r/rul/rulin/ruling__gb_1.mp3,постановление,[ˈru:lɪŋ],The FAA ruling applies to American airlines.,Постановление ФАУ распространяется на американские авиакомпании.
serve,verb,a2,https://www.oxfordlearnersdictionaries.com/media/english/uk_pron/s/ser/serve/serve__gb_1.mp3,служить,[sə:v],The Manhunters serve me now.,Сейчас Охотники служат мне.
bother,verb,b1,https://www.oxfordlearnersdictionaries.com/media/english/uk_pron/b/bot/bothe/bother__gb_1.mp3,беспокоить,[ˈbɔðə],Children often bother their parents.,Дети часто беспокоят своих родителей.
genocide,noun,c1,https://www.oxfordlearnersdictionaries.com/media/english/uk_pron/g/gen/genoc/genocide__gb_1.mp3,геноцид,,But “genocide” it is not.,Но это никак не «геноцид».
damage,noun,b1,https://www.oxfordlearnersdictionaries.com/media/english/uk_pron/d/dam/damag/damage__gb_2.mp3,ущерб,[ˈdæmɪdʒ],This is my damage report.,Вот мой отчёт об ущербе.
achieve,verb,a2,https://www.oxfordlearnersdictionaries.com/media/english/uk_pron/a/ach/achie/achieve__gb_2.mp3,достигать,[əˈtʃi:v],How did we achieve that?,Как мы этого достигли?
accountant,noun,b2,https://www.oxfordlearnersdictionaries.com/media/english/uk_pron/a/acc/accou/accountant__gb_1.mp3,бухгалтер,[əˈkauntənt],I'm your chief accountant.,Я же твой главный бухгалтер.
embody,verb,c1,https://www.oxfordlearnersdictionaries.com/media/english/uk_pron/e/emb/embod/embody__gb_1.mp3,воплощать,[ɪmˈbɔdɪ],Living organisms obviously embody arrangements of matter into complex structures.,"Живые организмы, очевидно, воплощают организации материи в сложные структуры."
party,noun,a1,https://www.oxfordlearnersdictionaries.com/media/english/uk_pron/p/par/party/party__gb_2.mp3,сторона,[ˈpɑ:tɪ],I &apos;m the injured party.,Ведь я - пострадавшая сторона.
praise,noun,b2,https://www.oxfordlearnersdictionaries.com/media/english/uk_pron/p/pra/prais/praise__gb_1.mp3,похвала,[preɪz],Others offered carefully worded praise.,Другие выступили со сдержанной похвалой в адрес Гэдди.
put,verb,a1,https://www.oxfordlearnersdictionaries.com/media/english/uk_pron/p/put/put__/put__gb_1.mp3,положить,[put],Put it where you like.,"Положи, где хочешь."
data,noun,a2,https://www.oxfordlearnersdictionaries.com/media/english/uk_pron/d/dat/data_/data__gb_5.mp3,данные,[ˈdeɪtə],Import data from SQL Server,Импорт данных из SQL Server
prepared,adjective,b1,https://www.oxfordlearnersdictionaries.com/media/english/uk_pron/p/pre/prepa/prepared__gb_1.mp3,подготовленный,[prɪˈpɛəd],Is the patient prepared for surgery?,Больной подготовлен к операции?
medal,noun,b2,https://www.oxfordlearnersdictionaries.com/media/english/uk_pron/m/med/medal/medal__gb_1.mp3,медаль,[ˈmedl],We won the bronze medal.,Мы выиграли бронзовую медаль.
evolution,noun,b2,https://www.oxfordlearnersdictionaries.com/media/english/uk_pron/e/evo/evolu/evolution__gb_1.mp3,эволюция,[ˌi:vəˈlu:ʃən],Evolution cannot be cut apart.,Эволюция не может быть разделена на части.
indoor,adjective,b1,https://www.oxfordlearnersdictionaries.com/media/english/uk_pron/i/ind/indoo/indoor__gb_1.mp3,внутренний,[ˈɪndɔ:],We drained the indoor to make room for presents.,"Из внутреннего мы слили воду, чтобы складывать туда подарки."
year,noun,a1,https://www.oxfordlearnersdictionaries.com/media/english/uk_pron/y/yea/year_/year__gb_1.mp3,год,[jə:],The Second Year of Europe,Второй «Год Европы»
merchant,noun,c1,https://www.oxfordlearnersdictionaries.com/media/english/uk_pron/m/mer/merch/merchant__gb_1.mp3,торговец,[ˈmə:tʃənt],Mr Brown is a wool merchant.,Мистер Браун торговец шерстью.
chemistry,noun,a2,https://www.oxfordlearnersdictionaries.com/media/english/uk_pron/c/che/chemi/chemistry__gb_2.mp3,химия,,"physics, biology, chemistry, engineering, etc.","Но это важно для исследований в таких областях науки (теоретических и прикладных), как, например, физика, биология, химия, инженерия и др., результаты которых могут быть использованы в производстве новых технологий."
intellectual,adjective,b2,https://www.oxfordlearnersdictionaries.com/media/english/uk_pron/i/int/intel/intellectual__gb_1.mp3,интеллектуальный,[ˌɪntɪˈlektjuəl],The second revolution is intellectual.,Вторая революция должна стать интеллектуальной.
investment,noun,b2,https://www.oxfordlearnersdictionaries.com/media/english/uk_pron/i/inv/inves/investment__gb_2.mp3,инвестиции,[ɪnˈvestmənt],6. Classification and investment objective,6. Классификация и цель инвестиций
ordinary,adjective,a2,https://www.oxfordlearnersdictionaries.com/media/english/uk_pron/o/ord/ordin/ordinary__gb_1.mp3,обычный,[ˈɔ:dnrɪ],Extraordinary Measures for Ordinary Times,Чрезвычайные меры в обычные времена
constituency,noun,c1,https://www.oxfordlearnersdictionaries.com/media/english/uk_pron/x/xco/xcons/xconstituency__gb_4.mp3,избирательный округ,[kənˈstɪtjuənsɪ],"The late Geoffrey Dickens, M.P. was attending a fete in his constituency.","Покойный Джефри Дикенс, член парламента, присутствовал как-то на одном мероприятии в своем избирательном округе."
necessity,noun,b2,https://www.oxfordlearnersdictionaries.com/media/english/uk_pron/n/nec/neces/necessity__gb_1.mp3,необходимость,[nɪˈsesɪtɪ],So it was a necessity.,Так что это было необходимостью.
cooking,noun,a1,https://www.oxfordlearnersdictionaries.com/media/english/uk_pron/c/coo/cooki/cooking__gb_1.mp3,приготовление,,Cooking takes up too much time.,Приготовление пищи отнимает слишком много времени.
end,noun,a1,https://www.oxfordlearnersdictionaries.com/media/english/uk_pron/e/end/end__/end__gb_1.mp3,конец,[end],The End of Kamikaze Pacifism?,Конец пацифизма камикадзе?
human,adjective,a2,https://www.oxfordlearnersdictionaries.com/media/english/uk_pron/h/hum/human/human__gb_1.mp3,человека,[ˈhju:mən],Exhibitions and human rights observances.,Выставки и торжественные мероприятия по тематике прав человека.
plead,verb,c1,https://www.oxfordlearnersdictionaries.com/media/english/uk_pron/p/ple/plead/plead__gb_1.mp3,умолять,[pli:d],I plead your lordships for clemency.,Я умоляю ваши светлости о снисхождении.
proceed,verb,b2,https://www.oxfordlearnersdictionaries.com/media/english/uk_pron/p/pro/proce/proceed__gb_1.mp3,продолжать,[prəˈsi:d],"Herr Janning, you may proceed.","Герр Яннинг, вы можете продолжать."
input,noun,b2,https://www.oxfordlearnersdictionaries.com/media/english/uk_pron/i/inp/input/input__gb_2.mp3,вклад,[ˈɪnput],"Enid, I need your input.","Инид, нужен твой вклад."
flourish,verb,c1,https://www.oxfordlearnersdictionaries.com/media/english/uk_pron/f/flo/flour/flourish__gb_1.mp3,процветать,[ˈflʌrɪʃ],"Meanwhile, Islamism was allowed to flourish unidentified.",Исламизм тем временем оставался незамеченным нами и процветал.
subscriber,noun,c1,https://www.oxfordlearnersdictionaries.com/media/english/uk_pron/s/sub/subsc/subscriber__gb_1.mp3,подписчик,[səbˈskraɪbə],Learn more about subscriber counts.,"Подробнее о том, как подсчитывается количество подписчиков, можно узнать из этой статьи."
loose,adjective,b2,https://www.oxfordlearnersdictionaries.com/media/english/uk_pron/l/loo/loose/loose__gb_1.mp3,свободный,[lu:s],"An unusual crowd, loose guest list.","Разношерстная толпа, свободный вход."
ought,verb,b1,https://www.oxfordlearnersdictionaries.com/media/english/uk_pron/a/aug/aught/aught__gb_1.mp3,следовало бы,[ɔ:t],He ought to have arrived home by now.,Ему уже следовало бы быть дома.
moment,noun,a1,https://www.oxfordlearnersdictionaries.com/media/english/uk_pron/m/mom/momen/moment__gb_1.mp3,момент,[ˈməumənt],It was an exciting moment.,Это был волнующий момент.
entrepreneur,noun,b2,https://www.oxfordlearnersdictionaries.com/media/english/uk_pron/e/ent/entre/entrepreneur__gb_1.mp3,предприниматель,[ˌɔntrəprəˈnə:],"Russian entrepreneur, business executive, and philanthropist","Российский предприниматель, руководитель компании и филантроп"
all right,adjective,a2,https://www.oxfordlearnersdictionaries.com/media/english/uk_pron/a/all/all_r/all_right_1_gb_2.mp3,в порядке,,"Temperance, are you all right?","Темперанс, ты в порядке?"
correct,adjective,a1,https://www.oxfordlearnersdictionaries.com/media/english/uk_pron/c/cor/corre/correct__gb_2.mp3,правильный,[kəˈrekt],Tell me the correct answer.,Скажи мне правильный ответ.
frame,noun,b1,https://www.oxfordlearnersdictionaries.com/media/english/uk_pron/f/fra/frame/frame__gb_1.mp3,рамка,[freɪm],"Oh, they broke my frame.","Ох, они пробили мою рамку."
boot,noun,a1,https://www.oxfordlearnersdictionaries.com/media/english/uk_pron/b/boo/boot_/boot__gb_2.mp3,сапог,[bu:t],I saw that same boot print up in the tree.,Я видел такие же следы от сапог на дереве.
