en_word,pos,level,mp3_url,ru_word,transcription,en_example,ru_example
mainland,noun,c1,https://www.oxfordlearnersdictionaries.com/media/english/uk_pron/m/mai/mainl/mainland__gb_2.mp3,материк,[ˈmeɪnlənd],"On the mainland, technological progress continued unimpeded.",На материке технический прогресс продолжался.
reform,noun,c1,https://www.oxfordlearnersdictionaries.com/media/english/uk_pron/r/ref/refor/reform__gb_1.mp3,реформа,[rɪ'fɔːm],Paying the Price of Reform,Цена реформ
devil,noun,c1,https://www.oxfordlearnersdictionaries.com/media/english/uk_pron/d/dev/devil/devil__gb_1.mp3,дьявол,[ˈdevl],"Men, thou art the devil.","Человек ты или дьявол, ты умрешь."
April,noun,a1,https://www.oxfordlearnersdictionaries.com/media/english/uk_pron/a/apr/april/april_1_gb_2.mp3,апрель,,"Last modified April 12, 2017",Последнее изменение: 12 апреля 2017 г.
bury,verb,b1,https://www.oxfordlearnersdictionaries.com/media/english/uk_pron/b/bur/bury_/bury__gb_1.mp3,похоронить,[ˈberɪ],Homeboy wants to bury himself.,Сам себя похоронит.
ranking,noun,c1,https://www.oxfordlearnersdictionaries.com/media/english/uk_pron/r/ran/ranki/ranking__gb_1.mp3,рейтинг,,"From General, click Comment Ranking",В разделе Общие нажмите Рейтинг комментариев.
junior,adjective,b2,https://www.oxfordlearnersdictionaries.com/media/english/uk_pron/j/jun/junio/junior__gb_1.mp3,младший,[ˈdʒu:njə],"Uh, junior I T analyst.",Младший системный аналитик.
sustain,verb,c1,https://www.oxfordlearnersdictionaries.com/media/english/uk_pron/s/sus/susta/sustain__gb_1.mp3,поддерживать,[səsˈteɪn],I have to sustain that objection.,Я вынужден поддержать этот протест.
contribute,verb,b2,https://www.oxfordlearnersdictionaries.com/media/english/uk_pron/x/xco/xcont/xcontribute__gb_1.mp3,способствовать,[kənˈtrɪbju:t],Poverty and unemployment contribute to rampant criminality.,Бедность и безработица способствуют разгулу преступности.
rebellion,noun,c1,https://www.oxfordlearnersdictionaries.com/media/english/uk_pron/r/reb/rebel/rebellion__gb_1.mp3,восстание,[rɪˈbeljən],"Extreme poverty breeds apathy, not rebellion.","Крайняя бедность порождает апатию, а не восстание."
peak,noun,c1,https://www.oxfordlearnersdictionaries.com/media/english/uk_pron/p/pea/peak_/peak__gb_2.mp3,пик,[pi:k],The excitement reached its peak.,Возбуждение достигло своего пика.
sweep,verb,b2,https://www.oxfordlearnersdictionaries.com/media/english/uk_pron/s/swe/sweep/sweep__gb_1.mp3,подметать,[swi:p],You didn't sweep up.,Ты не подметал.
viable,adjective,c1,https://www.oxfordlearnersdictionaries.com/media/english/uk_pron/v/via/viabl/viable__gb_1.mp3,жизнеспособный,[ˈvaɪəbl],"First, achieving a viable Ukraine.",Первый — это добиться существования жизнеспособной Украины.
virus,noun,a2,https://www.oxfordlearnersdictionaries.com/media/english/uk_pron/v/vir/virus/virus__gb_2.mp3,вирус,[ˈvaɪərəs],Virus detection and blocking SLA,Соглашение об уровне обслуживания относительно обнаружения и блокировки вирусов
achievement,noun,b1,https://www.oxfordlearnersdictionaries.com/media/english/uk_pron/a/ach/achie/achievement__gb_1.mp3,достижение,[əˈtʃi:vmənt],What an achievement that is.,Какое достижение.
biology,noun,a2,https://www.oxfordlearnersdictionaries.com/media/english/uk_pron/b/bio/biolo/biology__gb_2.mp3,биология,[baɪˈɔlədʒɪ],"physics, biology, chemistry, engineering, etc.","Но это важно для исследований в таких областях науки (теоретических и прикладных), как, например, физика, биология, химия, инженерия и др., результаты которых могут быть использованы в производстве новых технологий."
liberal,adjective,c1,https://www.oxfordlearnersdictionaries.com/media/english/uk_pron/l/lib/liber/liberal__gb_4.mp3,либеральный,[ˈlɪbərəl],The Rise of Liberal Japan,Усиление либеральной Японии
short,adjective,a1,https://www.oxfordlearnersdictionaries.com/media/english/uk_pron/s/sho/short/short__gb_3.mp3,короткий,[ʃɔ:t],The short answer is exports.,Ответ короткий - экспорт.
debate,noun,b2,https://www.oxfordlearnersdictionaries.com/media/english/uk_pron/d/deb/debat/debate__gb_2.mp3,дебаты,[dɪˈbeɪt],We're having a debate.,У нас - дебаты.
fatal,adjective,c1,https://www.oxfordlearnersdictionaries.com/media/english/uk_pron/f/fat/fatal/fatal__gb_1.mp3,смертельный,[ˈfeɪtl],"Several injured, no fatal wounds.","Несколько раненых, но не смертельно."
dam,noun,c1,https://www.oxfordlearnersdictionaries.com/media/english/uk_pron/d/dam/dam__/dam__gb_1.mp3,плотина,[dæm],"In 1970, the dam bursts.",В 1970 году прорывается плотина.
carrot,noun,a1,https://www.oxfordlearnersdictionaries.com/media/english/uk_pron/c/car/carro/carrot__gb_2.mp3,морковка,[ˈkærət],Delete rice pudding and carrot.,Удалить рисовый пудинг и морковку.
frustrating,adjective,c1,https://www.oxfordlearnersdictionaries.com/media/english/uk_pron/f/fru/frust/frustrating__gb_1.mp3,печальный,,And what's so frustrating is this is not a singular event;,"Что более печально, это не единственный случай."
ritual,noun,c1,https://www.oxfordlearnersdictionaries.com/media/english/uk_pron/r/rit/ritua/ritual__gb_1.mp3,ритуал,[ˈrɪtʃuəl],We're losing a ritual.,Мы теряем ритуал.
escape,noun,b1,https://www.oxfordlearnersdictionaries.com/media/english/uk_pron/e/esc/escap/escape__gb_1.mp3,побег,[ɪsˈkeɪp],Escape from a separatist prison!,Побег из сепаратистской тюрьмы!
formula,noun,c1,https://www.oxfordlearnersdictionaries.com/media/english/uk_pron/f/for/formu/formula__gb_3.mp3,формула,[ˈfɔ:mjulə],The formula for %K is:,Формула для расчета %K:
passionate,adjective,b2,https://www.oxfordlearnersdictionaries.com/media/english/uk_pron/p/pas/passi/passionate__gb_1.mp3,страстный,[ˈpæʃənɪt],"Also passionate, artistic and inquisitive.","А также страстна, артистична и любознательна."
reserve,noun,b2,https://www.oxfordlearnersdictionaries.com/media/english/uk_pron/r/res/reser/reserve__gb_1.mp3,резерв,[rɪ'zɜːv],Reserve for capital asset fund,Резерв для фонда капитальных активов
colleague,noun,a2,https://www.oxfordlearnersdictionaries.com/media/english/uk_pron/c/col/colle/colleague__gb_2.mp3,коллега,[ˈkɔli:ɡ],My colleague is newly single.,Мой недавно разведенный коллега.
dig,verb,b2,https://www.oxfordlearnersdictionaries.com/media/english/uk_pron/d/dig/dig__/dig__gb_1.mp3,рыть,[dɪɡ],We need a spade to dig a pit.,"Нам нужна лопата, раз мы хотим рыть яму."
committee,noun,b2,https://www.oxfordlearnersdictionaries.com/media/english/uk_pron/c/com/commi/committee__gb_1.mp3,комитет,[kəˈmɪtɪ],UNECE INLAND TRANSPORT COMMITTEE (ITC),КОМИТЕТ ПО ВНУТРЕННЕМУ ТРАНСПОРТУ (КВТ) ЕЭК ООН
outsider,noun,c1,https://www.oxfordlearnersdictionaries.com/media/english/uk_pron/o/out/outsi/outsider__gb_1.mp3,аутсайдер,[ˈautˈsaɪdə],"Fortunately, Britain has always been an outsider.","К счастью, Великобритания всегда была аутсайдером."
contempt,noun,c1,https://www.oxfordlearnersdictionaries.com/media/english/uk_pron/x/xco/xcont/xcontempt__gb_1.mp3,презрение,[kənˈtempt],Russia's Culture of Contempt,Российская культура презрения
access,noun,b1,https://www.oxfordlearnersdictionaries.com/media/english/uk_pron/a/acc/acces/access__gb_4.mp3,доступ,[ˈækses],Exchange 2013 Client Access server,Сервер клиентского доступа Exchange 2013
disturb,verb,b2,https://www.oxfordlearnersdictionaries.com/media/english/uk_pron/d/dis/distu/disturb__gb_1.mp3,нарушать,[dɪsˈtə:b],Those additions disturb the overall balance of the draft resolution.,Эти добавления нарушают общий баланс данного проекта резолюции.
enforcement,noun,c1,https://www.oxfordlearnersdictionaries.com/media/english/uk_pron/e/enf/enfor/enforcement__gb_1.mp3,осуществление,[ɪnˈfɔ:smənt],Enforcement is the most crucial element and the most difficult to sustain.,"Вопрос об осуществлении тех мер, которые решено будет принять, - это наиболее критически важный элемент и одновременно наиболее трудный в исполнении."
mathematics,noun,a2,https://www.oxfordlearnersdictionaries.com/media/english/uk_pron/m/mat/mathe/mathematics__gb_1.mp3,математика,[ˌmæθɪˈmætɪks],They require very similar mathematics.,Для их описания используется очень похожая математика.
exit,noun,b2,https://www.oxfordlearnersdictionaries.com/media/english/uk_pron/e/exi/exit_/exit__gb_1.mp3,выход,[ˈeksɪt],Go to the emergency exit,Идите к запасному выходу
casual,adjective,b2,https://www.oxfordlearnersdictionaries.com/media/english/uk_pron/c/cas/casua/casual__gb_1.mp3,случайный,[ˈkæʒjuəl],"It's called casual sex, Tandy.","Это называется случайный секс, Тэнди."
feather,noun,b2,https://www.oxfordlearnersdictionaries.com/media/english/uk_pron/f/fea/feath/feather__gb_1.mp3,перо,[ˈfeðə],The jay feather will lead you down the stream.,С пером сойки следуй вниз по реке.
sail,noun,b1,https://www.oxfordlearnersdictionaries.com/media/english/uk_pron/s/sai/sail_/sail__gb_2.mp3,парус,[seɪl],"Set all sail handsomely, three points starboard.","Поставить все паруса, три румба по правому борту."
help,noun,a1,https://www.oxfordlearnersdictionaries.com/media/english/uk_pron/h/hel/help_/help__gb_1.mp3,помощь,[help],A little help from Spenser.,С некоторой помощью Спенсера.
leak,noun,c1,https://www.oxfordlearnersdictionaries.com/media/english/uk_pron/l/lea/leak_/leak__gb_1.mp3,утечка,[li:k],Fixed memory leak in MediaView,Исправлена проблема утечки памяти в MediaView.
angle,noun,b2,https://www.oxfordlearnersdictionaries.com/media/english/uk_pron/a/ang/angle/angle__gb_1.mp3,угол,[ˈæŋɡl],The camera angle and focus,угол съемки и фокусировка камеры;
bail,noun,c1,https://www.oxfordlearnersdictionaries.com/media/english/uk_pron/b/bai/bail_/bail__gb_1.mp3,залог,[beɪl],Perry's father posted bail.,Отец Перри заплатил залог.
clinical,adjective,c1,https://www.oxfordlearnersdictionaries.com/media/english/uk_pron/c/cli/clini/clinical__gb_1.mp3,клинический,[ˈklɪnɪkəl],"Mood disorders, clinical depression, - schizophrenia.","Расстройства настроения, клиническая депрессия, шизофрения."
ignorance,noun,c1,https://www.oxfordlearnersdictionaries.com/media/english/uk_pron/i/ign/ignor/ignorance__gb_1.mp3,невежество,[ˈɪɡnərəns],Art has an enemy called ignorance,"У искусства есть враг, имя которому невежество"
card,noun,a1,https://www.oxfordlearnersdictionaries.com/media/english/uk_pron/c/car/card_/card__gb_1.mp3,карта,[kɑ:d],To install the SIM card:,Чтобы установить SIM-карту:
shortage,noun,b2,https://www.oxfordlearnersdictionaries.com/media/english/uk_pron/s/sho/short/shortage__gb_1.mp3,нехватка,[ˈʃɔ:tɪdʒ],Are you stocking up for a bitch shortage?,Чтобы создать стратегический запас на случай нехватки стерв?
meaning,noun,a1,https://www.oxfordlearnersdictionaries.com/media/english/uk_pron/m/mea/meani/meaning__gb_1.mp3,смысл,[ˈmi:nɪŋ],He was looking for meaning.,Он искал смысл.
questionnaire,noun,b2,https://www.oxfordlearnersdictionaries.com/media/english/uk_pron/q/que/quest/questionnaire__gb_2.mp3,вопросник,[ˌkwestɪəˈnɛə],Source: NATO Defence Planing Questionnaire 2004.,"Источник: Вопросник военного планирования НАТО, 2004 год."
crisis,noun,b2,https://www.oxfordlearnersdictionaries.com/media/english/uk_pron/c/cri/crisi/crisis__gb_3.mp3,кризис,[ˈkraɪsɪs],Europe’s Crisis of Leadership,Кризис руководства в Европе
willingness,noun,c1,https://www.oxfordlearnersdictionaries.com/media/english/uk_pron/w/wil/willi/willingness__gb_1.mp3,готовность,[ˈwɪlɪŋnɪs],So much for a willingness to talk.,Готовность «говорить» — налицо.
asylum,noun,c1,https://www.oxfordlearnersdictionaries.com/media/english/uk_pron/a/asy/asylu/asylum__gb_1.mp3,убежище,[əˈsaɪləm],Did that qualify them for asylum status?,Дает ли это им право на убежище?
infamous,adjective,c1,https://www.oxfordlearnersdictionaries.com/media/english/uk_pron/i/inf/infam/infamous__gb_1.mp3,печально известный,[ˈɪnfəməs],Madame LaLaurie was infamous for her vanity.,Мадам ЛаЛори была печально известна своим туалетным столиком.
fitness,noun,b1,https://www.oxfordlearnersdictionaries.com/media/english/uk_pron/f/fit/fitne/fitness__gb_1.mp3,пригодность,[ˈfɪtnɪs],Fitness for use and quality adjustment.,пригодность для использования и поправка на качество.
diagnose,verb,c1,https://www.oxfordlearnersdictionaries.com/media/english/uk_pron/d/dia/diagn/diagnose__gb_1.mp3,диагностировать,[ˈdaɪəɡnəuz],diagnose or fix technology problems,диагностировать или исправлять технические неполадки;
electoral,adjective,c1,https://www.oxfordlearnersdictionaries.com/media/english/uk_pron/e/ele/elect/electoral__gb_1.mp3,избирательный,[ɪˈlektərəl],"The Electoral Court, however, decided otherwise.","Избирательный Суд, однако, решил иначе."
marketing,noun,b1,https://www.oxfordlearnersdictionaries.com/media/english/uk_pron/m/mar/marke/marketing__gb_1.mp3,маркетинг,[ˈmɑ:kɪtɪŋ],Integration of Sales and marketing,Интеграция Продаж и маркетинга
beef,noun,a2,https://www.oxfordlearnersdictionaries.com/media/english/uk_pron/b/bee/beef_/beef__gb_1.mp3,говядина,[bi:f],Maybe it's beef stew!,Может быть тушёная говядина!
cell,noun,b2,https://www.oxfordlearnersdictionaries.com/media/english/uk_pron/c/cel/cell_/cell__gb_1.mp3,ячейка,[sel],Entering data in a cell,Ввод данных в ячейке
intended,adjective,b2,https://www.oxfordlearnersdictionaries.com/media/english/uk_pron/i/int/inten/intended__gb_1.mp3,намеренный,[ɪnˈtendɪd],Let me nip this in the bud right now. *pun intended*.,Давайте я остановлю это в зародыше. *каламбур намеренный*.
show,noun,a1,https://www.oxfordlearnersdictionaries.com/media/english/uk_pron/s/sho/show_/show__gb_5.mp3,шоу,[ʃəu],The Rocky Horror Picture Show.,Шоу ужасов Рокки Хоррора.
fabric,noun,b2,https://www.oxfordlearnersdictionaries.com/media/english/uk_pron/f/fab/fabri/fabric__gb_1.mp3,ткань,[ˈfæbrɪk],The fabric alone weighs two tons.,Только сама ткань весит две тонны.
offence,noun,b2,https://www.oxfordlearnersdictionaries.com/media/english/uk_pron/o/off/offen/offence__gb_1.mp3,преступление,[əˈfens],Every person commits an offence who,"Совершает преступление любое лицо, которое"
cater,verb,c1,https://www.oxfordlearnersdictionaries.com/media/english/uk_pron/c/cat/cater/cater__gb_1.mp3,обслуживать,[ˈkeɪtə],"They cater to tourists, honeymooners.","Они обслуживают туристов, молодоженов."
counsellor,noun,c1,https://www.oxfordlearnersdictionaries.com/media/english/uk_pron/c/cou/couns/counsellor__gb_1.mp3,консультант,[ˈkaunslə],With a marriage guidance counsellor.,Согласно с консультантом по браку.
task,noun,a2,https://www.oxfordlearnersdictionaries.com/media/english/uk_pron/t/tas/task_/task__gb_3.mp3,задача,[tɑ:sk],LEARN MORE ABOUT TASK MANAGEMENT,ПОДРОБНЕЕ ОБ УПРАВЛЕНИИ ЗАДАЧАМИ
tomorrow,noun,a1,https://www.oxfordlearnersdictionaries.com/media/english/uk_pron/t/tom/tomor/tomorrow__gb_1.mp3,завтрашний день,,The United Europe of Tomorrow?,Соединённая Европа завтрашнего дня?
mere,adjective,c1,https://www.oxfordlearnersdictionaries.com/media/english/uk_pron/m/mer/mere_/mere__gb_1.mp3,простой,[mɪə],This is no mere coincidence.,Это не просто совпадение.
talk,noun,a2,https://www.oxfordlearnersdictionaries.com/media/english/uk_pron/t/tal/talk_/talk__gb_1.mp3,переговоры,[tɔ:k],Time to Talk with Iran,Время начать переговоры с Ираном
odds,noun,c1,https://www.oxfordlearnersdictionaries.com/media/english/uk_pron/o/odd/odds_/odds__gb_1.mp3,шансы,[ɔdz],The military odds appear daunting.,"Получается, что шансы на успех военной операции совсем невелики."
cost,noun,a1,https://www.oxfordlearnersdictionaries.com/media/english/uk_pron/c/cos/cost_/cost__gb_1.mp3,затраты,[kɔst],"Debt restructuring, cost cutting, layoffs.","Реструктуризация долга, снижение затрат, увольнения."
race,noun,a2,https://www.oxfordlearnersdictionaries.com/media/english/uk_pron/r/rac/race_/race__gb_2.mp3,раса,[reɪs],The Aryan race will fight back.,Арийская раса будет отбиваться.
balloon,noun,b2,https://www.oxfordlearnersdictionaries.com/media/english/uk_pron/b/bal/ballo/balloon__gb_2.mp3,воздушный шар,[bəˈlu:n],"rather, it becomes a leaky balloon.","она, скорее, становится похожей на прохудившийся воздушный шар."
stamp,noun,a2,https://www.oxfordlearnersdictionaries.com/media/english/uk_pron/s/sta/stamp/stamp__gb_1.mp3,марка,[stæmp],Please show me your stamp album.,"Покажи мне, пожалуйста, свой альбом марок."
imagination,noun,b2,https://www.oxfordlearnersdictionaries.com/media/english/uk_pron/i/ima/imagi/imagination__gb_1.mp3,воображение,[ɪˌmædʒɪˈneɪʃən],Janet Echelman: Taking imagination seriously,Джанет Эчелмен воспринимает воображение всерьёз
underground,adjective,a2,https://www.oxfordlearnersdictionaries.com/media/english/uk_pron/u/und/under/underground__gb_1.mp3,подземный,['ʌndəgraund],And then from underground to underwater.,А теперь от подземного к подводному.
submission,noun,c1,https://www.oxfordlearnersdictionaries.com/media/english/uk_pron/s/sub/submi/submission__gb_1.mp3,представление,[səbˈmɪʃən],Addresses for submission of registration form:,Адреса для представления бланков регистрации:
creep,verb,c1,https://www.oxfordlearnersdictionaries.com/media/english/uk_pron/c/cre/creep/creep__gb_1.mp3,подкрадываться,[kri:p],Doubt and fear always creep in.,Когда к нам подкрадываются страх и сомнения.
dollar,noun,a1,https://www.oxfordlearnersdictionaries.com/media/english/uk_pron/d/dol/dolla/dollar__gb_2.mp3,доллар,[ˈdɔlə],Russia's Million Dollar Hackers,Русские хакеры на миллион долларов
figure,noun,a2,https://www.oxfordlearnersdictionaries.com/media/english/uk_pron/f/fig/figur/figure__gb_3.mp3,цифра,[ˈfɪɡə],That is a stunning figure.,Это колоссальная цифра.
notorious,adjective,c1,https://www.oxfordlearnersdictionaries.com/media/english/uk_pron/n/not/notor/notorious__gb_1.mp3,известный,[nəuˈtɔ:rɪəs],He is a notorious womanizer.,Он всем известный бабник.
argument,noun,a2,https://www.oxfordlearnersdictionaries.com/media/english/uk_pron/a/arg/argum/argument__gb_3.mp3,аргумент,[ˈɑ:ɡjumənt],The compare argument settings are:,Аргумент сравнение может принимать следующие значения:
align,verb,c1,https://www.oxfordlearnersdictionaries.com/media/english/uk_pron/a/ali/align/align__gb_1.mp3,присоединяться,[əˈlaɪn],Moscow is determined to break Tbilisi's will to align with the West.,"Москва решительно настроена на то, чтобы сломить волю Тбилиси присоединиться к Западу."
dub,verb,c1,https://www.oxfordlearnersdictionaries.com/media/english/uk_pron/d/dub/dub__/dub__gb_1.mp3,называть,[dʌb],To dub Russia's approach to the UN as purely obstructionist is hardly supported by the facts.,Попытки назвать российский подход к ООН чистым саботажем вряд ли можно назвать успешными и основанными на фактах.
superb,adjective,c1,https://www.oxfordlearnersdictionaries.com/media/english/uk_pron/s/sup/super/superb__gb_1.mp3,превосходный,[sju:ˈpə:b],Not the steadiest hand for a superb marksman.,Не особо устойчивая рука для превосходного стрелка.
prevalence,noun,c1,https://www.oxfordlearnersdictionaries.com/media/english/uk_pron/p/pre/preva/prevalence__gb_1.mp3,распространенность,[ˈprevələns],Interstitial lung diseases vary considerably in incidence and prevalence.,Промежуточные легочные заболевания значительно отличаются по частоте и распространенности.
statistical,adjective,c1,https://www.oxfordlearnersdictionaries.com/media/english/uk_pron/s/sta/stati/statistical__gb_2.mp3,статистический,[stəˈtɪstɪkəl],"However, statistical information is lost.",Однако статистическая информация при этом будет потеряна.
economist,noun,b2,https://www.oxfordlearnersdictionaries.com/media/english/uk_pron/e/eco/econo/economist__gb_1.mp3,экономист,[i:ˈkɔnəmɪst],"And so, asks The Economist:","И вот, журнал ""Экономист"" пишет:"
headquarters,noun,b2,https://www.oxfordlearnersdictionaries.com/media/english/uk_pron/h/hea/headq/headquarters__gb_1.mp3,штаб,[ˈhedˈkwɔ:təz],c Eastern Division headquarters (Kisangani).,с Штаб Восточной дивизии (Кисангани).
isolation,noun,c1,https://www.oxfordlearnersdictionaries.com/media/english/uk_pron/i/iso/isola/isolation__gb_1.mp3,изоляция,[ˌaɪsəuˈleɪʃən],We know that isolation kills.,"Как известно, изоляция смерти подобна."
weakness,noun,b2,https://www.oxfordlearnersdictionaries.com/media/english/uk_pron/w/wea/weakn/weakness__gb_2.mp3,слабость,[ˈwi:knɪs],Sleepiness is weakness of character.,Сонливость - это слабость характера.
impressive,adjective,b1,https://www.oxfordlearnersdictionaries.com/media/english/uk_pron/i/imp/impre/impressive__gb_1.mp3,впечатляющий,[ɪmˈpresɪv],"It's impressive work, milord.","Впечатляющая работа, милорд."
capability,noun,c1,https://www.oxfordlearnersdictionaries.com/media/english/uk_pron/c/cap/capab/capability__gb_1.mp3,возможность,,Capability to expand the system,Возможность расширения системы
tax,noun,b1,https://www.oxfordlearnersdictionaries.com/media/english/uk_pron/t/tax/tax__/tax__gb_1.mp3,налог,[tæks],Taxes other than income tax,"Налоги, за исключением налога на прибыль"
strip,noun,c1,https://www.oxfordlearnersdictionaries.com/media/english/uk_pron/s/str/strip/strip__gb_1.mp3,полоса,[strɪp],"Yeah, big strip down his back.","Да, большая полоса на его спине."
commit,verb,b1,https://www.oxfordlearnersdictionaries.com/media/english/uk_pron/c/com/commi/commit__gb_2.mp3,совершать,[kəˈmɪt],You didn't commit adultery.,Ты не совершала прелюбодеяние.
thrive,verb,c1,https://www.oxfordlearnersdictionaries.com/media/english/uk_pron/t/thr/thriv/thrive__gb_1.mp3,процветать,[θraɪv],Our country will thrive and prosper again.,Наша страна будет снова процветать и преуспевать.
