en_word,pos,level,mp3_url,ru_word,transcription,en_example,ru_example
sibling,noun,b2,https://www.oxfordlearnersdictionaries.com/media/english/uk_pron/s/sib/sibli/sibling__gb_2.mp3,братья и сестры,[ˈsɪblɪŋ],All of my siblings are taller than me.,Все мои братья и сёстры выше меня.
ultimate,adjective,b2,https://www.oxfordlearnersdictionaries.com/media/english/uk_pron/u/ult/ultim/ultimate__gb_1.mp3,конечный,[ˈʌltɪmɪt],Is there an ultimate destination?,Существует ли некое конечное назначение?
weaken,verb,c1,https://www.oxfordlearnersdictionaries.com/media/english/uk_pron/w/wea/weake/weaken__gb_1.mp3,ослаблять,[ˈwi:kən],“Nothing could weaken our unity.”,– Ничто не может ослабить наше единство».
biological,adjective,b2,https://www.oxfordlearnersdictionaries.com/media/english/uk_pron/b/bio/biolo/biological__gb_2.mp3,биологический,[ˌbaɪəuˈlɔdʒɪkəl],Biological yield is really important.,Биологический выход очень важен.
scientist,noun,a1,https://www.oxfordlearnersdictionaries.com/media/english/uk_pron/s/sci/scien/scientist__gb_2.mp3,ученый,[ˈsaɪəntɪst],He was a NASA space scientist.,Он был космическим ученым в НАСА.
status,noun,b2,https://www.oxfordlearnersdictionaries.com/media/english/uk_pron/s/sta/statu/status__gb_3.mp3,статус,[ˈstaeɪtəs],Status is really good motivator.,Статус - это очень хороший мотиватор.
widespread,adjective,b2,https://www.oxfordlearnersdictionaries.com/media/english/uk_pron/w/wid/wides/widespread__gb_2.mp3,распространенный,[ˈwaɪdspred],These infringements are surprisingly widespread.,Эти нарушения удивительно широко распространены.
favourite,adjective,a1,https://www.oxfordlearnersdictionaries.com/media/english/uk_pron/f/fav/favou/favourite__gb_1.mp3,любимый,[ˈfeɪvərɪt],What is your favourite food?,"Отлично, твоя любимая еда?"
story,noun,a1,https://www.oxfordlearnersdictionaries.com/media/english/uk_pron/s/sto/story/story__gb_1.mp3,история,[ˈstɔ:rɪ],"True story, by the way.","Реальная история, кстати."
persuade,verb,b1,https://www.oxfordlearnersdictionaries.com/media/english/uk_pron/p/per/persu/persuade__gb_2.mp3,убеждать,[pəˈsweɪd],What might persuade the Russians?,Как можно убедить русских?
vibrant,adjective,c1,https://www.oxfordlearnersdictionaries.com/media/english/uk_pron/v/vib/vibra/vibrant__gb_1.mp3,яркий,[ˈvaɪbrənt],"It creates a vibrant, energetic community where people admire and respect each other.","Это создает яркое, энергичное сообщество, в котором люди восхищают и уважают друг друга."
diet,noun,a1,https://www.oxfordlearnersdictionaries.com/media/english/uk_pron/d/die/diet_/diet__gb_1.mp3,диета,[ˈdaɪət],"A Healthy, Climate-Friendly Diet","О здоровой, климатической диете"
empirical,adjective,c1,https://www.oxfordlearnersdictionaries.com/media/english/uk_pron/e/emp/empir/empirical__gb_1.mp3,эмпирический,[emˈpɪrɪkəl],"Not much, the empirical evidence suggests.","Не очень важным, как показывают эмпирические факты."
vacation,noun,a1,https://www.oxfordlearnersdictionaries.com/media/english/uk_pron/v/vac/vacat/vacation__gb_2.mp3,отпуск,[vəˈkeɪʃən],He took an unpaid vacation.,Он взял отпуск за свой счет.
word,noun,a1,https://www.oxfordlearnersdictionaries.com/media/english/uk_pron/w/wor/word_/word__gb_1.mp3,слово,[wə:d],"Here's the word ""mirror.""","Вот слово ""mirror"" ."
wheel,noun,a2,https://www.oxfordlearnersdictionaries.com/media/english/uk_pron/w/whe/wheel/wheel__gb_1.mp3,колесо,[wi:l],You're turning the wheel.,Ты поворачиваешь колесо.
spider,noun,a2,https://www.oxfordlearnersdictionaries.com/media/english/uk_pron/s/spi/spide/spider__gb_2.mp3,паук,[ˈspaɪdə],I am a hungry spider.,Я голодный паук.
political,adjective,b1,https://www.oxfordlearnersdictionaries.com/media/english/uk_pron/p/pol/polit/political__gb_2.mp3,политический,[pəˈlɪtɪkəl],The political implication is minimal.,Особых политических последствий его слова иметь не будут.
determined,adjective,b1,https://www.oxfordlearnersdictionaries.com/media/english/uk_pron/d/det/deter/determined__gb_1.mp3,определенный,[dɪˈtə:mɪnd],The impact on upgrade has not been determined.,Влияние на обновление не определено.
jet,noun,b2,https://www.oxfordlearnersdictionaries.com/media/english/uk_pron/j/jet/jet__/jet__gb_1.mp3,самолет,[dʒet],The jet landed at Tokyo.,Самолёт сел в Токио.
throw,verb,a2,https://www.oxfordlearnersdictionaries.com/media/english/uk_pron/t/thr/throw/throw__gb_2.mp3,бросать,[θrəu],Can I throw dirt clods?,Могу я бросить грязные комки?
tighten,verb,c1,https://www.oxfordlearnersdictionaries.com/media/english/uk_pron/t/tig/tight/tighten__gb_1.mp3,ужесточать,[ˈtaɪtn],How might India tighten its patent system?,Как могут ужесточить Индии ее патентную систему?
face,noun,a1,https://www.oxfordlearnersdictionaries.com/media/english/uk_pron/f/fac/face_/face__gb_3.mp3,лицо,[feɪs],Your face rings a bell.,Ваше лицо мне знакомо.
cooker,noun,a2,https://www.oxfordlearnersdictionaries.com/media/english/uk_pron/c/coo/cooke/cooker__gb_2.mp3,плита,[ˈkukə],"I was making my breakfast, and one of my kippers slipped down the back of the cooker.","Я готовил завтрак, и одна из моих рыбин выскользнула за плиту."
tidy,adjective,a2,https://www.oxfordlearnersdictionaries.com/media/english/uk_pron/t/tid/tidy_/tidy__gb_1.mp3,опрятный,[ˈtaɪdɪ],"Neat and tidy, like us.","Опрятно и пристойно, как у нас."
literary,adjective,b2,https://www.oxfordlearnersdictionaries.com/media/english/uk_pron/l/lit/liter/literary__gb_1.mp3,литературный,[ˈlɪtərərɪ],Spijkenisse has written literary history.,Спейкениссе написал свою литературную историю.
typical,adjective,a2,https://www.oxfordlearnersdictionaries.com/media/english/uk_pron/t/typ/typic/typical__gb_1.mp3,типичный,,He is a typical Japanese.,Он - типичный японец.
operation,noun,b1,https://www.oxfordlearnersdictionaries.com/media/english/uk_pron/o/ope/opera/operation__gb_1.mp3,операция,[ˌɔpəˈreɪʃən],Reschedule a job or operation,Перепланирование задания или операции
arise,verb,b2,https://www.oxfordlearnersdictionaries.com/media/english/uk_pron/a/ari/arise/arise__gb_2.mp3,возникать,[əˈraɪz],The question doesn't arise,Вопросов не возникает
genuine,adjective,b2,https://www.oxfordlearnersdictionaries.com/media/english/uk_pron/g/gen/genui/genuine__gb_1.mp3,подлинный,[ˈdʒenjuɪn],I am the genuine article.,Я подлинный товар.
machinery,noun,c1,https://www.oxfordlearnersdictionaries.com/media/english/uk_pron/m/mac/machi/machinery__gb_1.mp3,механизм,[məˈʃi:nərɪ],It could be a cheap lubricant leeching into the machinery.,"Возможно, дешевое машинное масло просочилась в механизм."
military,adjective,b2,https://www.oxfordlearnersdictionaries.com/media/english/uk_pron/m/mil/milit/military__gb_1.mp3,военный,[ˈmɪlɪtərɪ],It was Soviet Military Power.,Журнал назывался «Советская военная мощь» (Soviet Military Power).
synthesis,noun,c1,https://www.oxfordlearnersdictionaries.com/media/english/uk_pron/s/syn/synth/synthesis__gb_1.mp3,синтез,[ˈsɪnθɪsɪs],It ended with a new synthesis:,Конец этому положил синтез.
abandon,verb,b2,https://www.oxfordlearnersdictionaries.com/media/english/uk_pron/a/aba/aband/abandon__gb_2.mp3,отказываться,[əˈbændən],So you abandon your investment plan.,"Поэтому, вы отказываетесь от вашего инвестиционного плана."
period,noun,a1,https://www.oxfordlearnersdictionaries.com/media/english/uk_pron/p/per/perio/period__gb_2.mp3,период,[ˈpɪərɪəd],N — is the smoothing period.,N — период сглаживания.
presentation,noun,b1,https://www.oxfordlearnersdictionaries.com/media/english/uk_pron/p/pre/prese/presentation__gb_2.mp3,презентация,[ˌprezenˈteɪʃən],Prepare and run your presentation.,Подготовка и проведение презентации
satellite,noun,b2,https://www.oxfordlearnersdictionaries.com/media/english/uk_pron/s/sat/satel/satellite__gb_1.mp3,спутник,[ˈsætəlaɪt],"Satellite of long, long ago.","Старый, старый, старый спутник."
oven,noun,a2,https://www.oxfordlearnersdictionaries.com/media/english/uk_pron/o/ove/oven_/oven__gb_1.mp3,духовка,[ˈʌvn],Crows took my corkscrew into the oven.,Вороны утащили мой штопор в духовку.
play,noun,a1,https://www.oxfordlearnersdictionaries.com/media/english/uk_pron/p/pla/play_/play__gb_1.mp3,игра,[pleɪ],And it was serious play.,Это была серьезная игра.
duration,noun,b2,https://www.oxfordlearnersdictionaries.com/media/english/uk_pron/d/dur/durat/duration__gb_3.mp3,продолжительность,[djuəˈreɪʃən],Provide video of minimum duration,Выберите видео минимальной продолжительности.
seek,verb,b2,https://www.oxfordlearnersdictionaries.com/media/english/uk_pron/s/see/seek_/seek__gb_1.mp3,стремиться,[si:k],"Above all, I seek results.",Но прежде всего я стремлюсь к достижению результатов.
thin,adjective,a2,https://www.oxfordlearnersdictionaries.com/media/english/uk_pron/t/thi/thin_/thin__gb_2.mp3,тонкий,[θɪn],They're those thin pancakes.,Это такие тонкие оладьи.
rose,noun,b2,https://www.oxfordlearnersdictionaries.com/media/english/uk_pron/r/ros/rose_/rose__gb_3.mp3,роза,[rəuz],"O Rose, thou art sick!","О, роза, ты больна!"
prescribe,verb,c1,https://www.oxfordlearnersdictionaries.com/media/english/uk_pron/p/pre/presc/prescribe__gb_1.mp3,предписывать,[prɪsˈkraɪb],In fact some doctors prescribe it.,"Более того, некоторые доктора предписывают эту игру."
beach,noun,a1,https://www.oxfordlearnersdictionaries.com/media/english/uk_pron/b/bea/beach/beach__gb_2.mp3,пляж,[bi:tʃ],"On the beach, with driftwood.","На пляже, с водорослями."
interpret,verb,b2,https://www.oxfordlearnersdictionaries.com/media/english/uk_pron/i/int/inter/interpret__gb_3.mp3,толковать,[ɪnˈtə:prɪt],Our job is not to interpret orders.,Нам не положено приказы толковать.
stare,verb,b2,https://www.oxfordlearnersdictionaries.com/media/english/uk_pron/s/sta/stare/stare__gb_1.mp3,смотреть,[stɛə],"Uh, try not to stare.",Постарайся не смотреть так пристально.
victim,noun,b1,https://www.oxfordlearnersdictionaries.com/media/english/uk_pron/v/vic/victi/victim__gb_1.mp3,жертва,[ˈvɪktɪm],Think our victim had dreadlocks.,"Думаю, у нашей жертвы были дреды."
diplomatic,adjective,c1,https://www.oxfordlearnersdictionaries.com/media/english/uk_pron/d/dip/diplo/diplomatic__gb_1.mp3,дипломатический,[ˌdɪpləˈmætɪk],Diplomatic asylum and territorial asylum,дипломатическое убежище и территориальное убежище
button,noun,a2,https://www.oxfordlearnersdictionaries.com/media/english/uk_pron/b/but/butto/button__gb_2.mp3,кнопка,[ˈbʌtn],Click the Generate periods button.,Нажмите кнопку Генерация периодов.
compensate,verb,c1,https://www.oxfordlearnersdictionaries.com/media/english/uk_pron/c/com/compe/compensate__gb_1.mp3,компенсировать,[ˈkɔmpenseɪt],Money cannot compensate for life.,Деньгами не компенсировать жизнь.
drop,noun,b1,https://www.oxfordlearnersdictionaries.com/media/english/uk_pron/d/dro/drop_/drop__gb_2.mp3,падение,[drɔp],This drop is due to three causes.,Это падение вызвано тремя причинами.
attraction,noun,b1,https://www.oxfordlearnersdictionaries.com/media/english/uk_pron/a/att/attra/attraction__gb_3.mp3,привлекательность,[əˈtrækʃən],Part of the attraction is enhanced participation.,"Частью привлекательности, является усиленное участие резидентов."
method,noun,a2,https://www.oxfordlearnersdictionaries.com/media/english/uk_pron/m/met/metho/method__gb_2.mp3,метод,[ˈmeθəd],(SysQueryRanget Util method between parenthesis),(метод SysQueryRanget Util в скобках)
extraordinary,adjective,b2,https://www.oxfordlearnersdictionaries.com/media/english/uk_pron/e/ext/extra/extraordinary__gb_1.mp3,чрезвычайный,[ɪksˈtrɔ:dnrɪ],But such agreement is extraordinary.,Но такое единодушие - явление чрезвычайно редкое.
item,noun,a2,https://www.oxfordlearnersdictionaries.com/media/english/uk_pron/i/ite/item_/item__gb_2.mp3,пункт,[ˈaɪtəm],Item 10: Dog collars incorporating:,"Пункт 10: Собачьи ошейники, снабженные:"
scene,noun,a2,https://www.oxfordlearnersdictionaries.com/media/english/uk_pron/s/sce/scene/scene__gb_1.mp3,место,[si:n],Plainclothes officers at the scene!,Офицеры в штатском на месте происшествия!
chronic,adjective,c1,https://www.oxfordlearnersdictionaries.com/media/english/uk_pron/c/chr/chron/chronic__gb_2.mp3,хронический,[ˈkrɔnɪk],Facing Up to Chronic Disease,Быть готовым к хроническим болезням
mayor,noun,b2,https://www.oxfordlearnersdictionaries.com/media/english/uk_pron/m/may/mayor/mayor__gb_1.mp3,мэр,[mɛə],You are the damned mayor.,Ты чертов мэр.
dispose,verb,c1,https://www.oxfordlearnersdictionaries.com/media/english/uk_pron/d/dis/dispo/dispose__gb_1.mp3,распоряжаться,[dɪsˈpəuz],"Moreover, Dalits are increasingly refusing to dispose of cow carcasses.","Кроме того, далиты все чаще отказываются распоряжаться коровьими тушами."
outbreak,noun,c1,https://www.oxfordlearnersdictionaries.com/media/english/uk_pron/o/out/outbr/outbreak__gb_1.mp3,вспышка,[ˈautbreɪk],I caused an outbreak of conjunctivitis.,Из-за меня случилась вспышка коньюктивита.
bit,noun,a2,https://www.oxfordlearnersdictionaries.com/media/english/uk_pron/b/bit/bit__/bit__gb_1.mp3,часть,[bɪt],We just need to find a straight bit.,Нам нужно только найти прямую часть дороги.
guy,noun,a2,https://www.oxfordlearnersdictionaries.com/media/english/uk_pron/g/guy/guy__/guy__gb_1.mp3,парень,[ɡaɪ],This guy was your BFF?,Этот парень был твоим лучшим другом?
pleasure,noun,b1,https://www.oxfordlearnersdictionaries.com/media/english/uk_pron/p/ple/pleas/pleasure__gb_1.mp3,удовольствие,[ˈpleʒə],Nobody eats crackers for pleasure.,Никто не ест крекеры для удовольствия.
port,noun,b1,https://www.oxfordlearnersdictionaries.com/media/english/uk_pron/p/por/port_/port__gb_1.mp3,порт,[pɔ:t],Port nacelle has been hit.,Порт гондолы получил повреждение.
violent,adjective,b1,https://www.oxfordlearnersdictionaries.com/media/english/uk_pron/v/vio/viole/violent__gb_1.mp3,насильственный,[ˈvaɪələnt],No religion is inherently violent.,Ни одна религия не является изначально насильственной.
mount,verb,b2,https://www.oxfordlearnersdictionaries.com/media/english/uk_pron/m/mou/mount/mount__gb_1.mp3,устанавливать,[maunt],We're gonna mount those plates on posts downwind of the Hill.,Мы установим эти кассеты с подветренной стороны Холма.
realm,noun,c1,https://www.oxfordlearnersdictionaries.com/media/english/uk_pron/r/rea/realm/realm__gb_1.mp3,сфера,[relm],This is already taking place in the trade realm.,Это уже происходит в сфере торговли.
hilarious,adjective,b2,https://www.oxfordlearnersdictionaries.com/media/english/uk_pron/h/hil/hilar/hilarious__gb_1.mp3,веселый,[hɪˈlɛərɪəs],I personally thought it made watching that show hilarious.,Лично я думала это сделает просмотр этого шоу весёлым.
money,noun,a1,https://www.oxfordlearnersdictionaries.com/media/english/uk_pron/m/mon/money/money__gb_1.mp3,деньги,[ˈmʌnɪ],Spend money and enjoy life!,Трать деньги и наслаждайся жизнью.
convince,verb,b1,https://www.oxfordlearnersdictionaries.com/media/english/uk_pron/x/xco/xconv/xconvince__gb_2.mp3,убеждать,[kənˈvɪns],It is hard to convince John.,Джона трудно убедить.
rival,adjective,b2,https://www.oxfordlearnersdictionaries.com/media/english/uk_pron/r/riv/rival/rival__gb_1.mp3,конкурирующий,[ˈraɪvəl],Two rival parties are essential to good democratic government.,Для демократического правительства важно наличие двух конкурирующих партий.
investigation,noun,b2,https://www.oxfordlearnersdictionaries.com/media/english/uk_pron/i/inv/inves/investigation__gb_2.mp3,расследование,,Is our investigation bothering you?,Это расследование докучает вам?
elegant,adjective,b2,https://www.oxfordlearnersdictionaries.com/media/english/uk_pron/e/ele/elega/elegant__gb_1.mp3,элегантный,[ˈelɪɡənt],What an elegant summer dress.,Какое элегантное летнее платье.
rely,verb,b2,https://www.oxfordlearnersdictionaries.com/media/english/uk_pron/r/rel/rely_/rely__gb_1.mp3,полагаться,[rɪˈlaɪ],And we rely on others.,И мы полагаемся на суждение других.
add,verb,a1,https://www.oxfordlearnersdictionaries.com/media/english/uk_pron/a/add/add__/add__gb_2.mp3,добавлять,[æd],Add contacts to get started,"Добавьте контакты, чтобы приступить к работе"
remote,adjective,b1,https://www.oxfordlearnersdictionaries.com/media/english/uk_pron/r/rem/remot/remote__gb_3.mp3,дистанционный,[rɪˈməut],And Magnus' remote triggering device.,И дистанционный пульт управления Магнуса.
switch,noun,b2,https://www.oxfordlearnersdictionaries.com/media/english/uk_pron/s/swi/switc/switch__gb_1.mp3,переключатель,[swɪtʃ],A light switch for neurons,Переключатель для нейронов
timing,noun,b2,https://www.oxfordlearnersdictionaries.com/media/english/uk_pron/t/tim/timin/timing__gb_1.mp3,время,[ˈtaɪmɪŋ],The timing was highly significant:,Выбор времени имел большое значение:
talented,adjective,b1,https://www.oxfordlearnersdictionaries.com/media/english/uk_pron/t/tal/talen/talented__gb_1.mp3,талантливый,[ˈtæləntɪd],"So, some very talented people.",Это очень талантливые люди.
position,noun,a2,https://www.oxfordlearnersdictionaries.com/media/english/uk_pron/p/pos/posit/position__gb_2.mp3,позиция,[pəˈzɪʃən],He occupies a key position.,Он занял ключевую позицию.
pregnancy,noun,c1,https://www.oxfordlearnersdictionaries.com/media/english/uk_pron/p/pre/pregn/pregnancy__gb_1.mp3,беременность,[ˈpreɡnənsɪ],It's an extrauterine pregnancy.,Это внематочная беременность.
tape,noun,b1,https://www.oxfordlearnersdictionaries.com/media/english/uk_pron/t/tap/tape_/tape__gb_1.mp3,лента,[teɪp],Mr. Lightyear wants more tape.,Мистеру Светику нужна еще кассетная лента.
traveller,noun,a2,https://www.oxfordlearnersdictionaries.com/media/english/uk_pron/t/tra/trave/traveller__gb_1.mp3,путешественник,[ˈtrævlə],"And Jeff's advice was, ""Be a traveller, not a tourist.","Совет Джефа был таким: ""Будьте путешественниками, а не туристами."
wait,noun,a2,https://www.oxfordlearnersdictionaries.com/media/english/uk_pron/w/wai/wait_/wait__gb_1.mp3,ожидание,[weɪt],3. Submit and Wait for Approval,3. Отправка и ожидание утверждения
restoration,noun,c1,https://www.oxfordlearnersdictionaries.com/media/english/uk_pron/r/res/resto/restoration__gb_1.mp3,восстановление,[ˌrestəˈreɪʃən],Conservation and restoration of biotopes;,сохранение и восстановление биотопов;
proclaim,verb,c1,https://www.oxfordlearnersdictionaries.com/media/english/uk_pron/p/pro/procl/proclaim__gb_1.mp3,провозглашать,[prəˈkleɪm],"Pollute Sacred Arabia, and proclaim",Оскверняют Священную Аравию и провозглашают
chance,noun,a2,https://www.oxfordlearnersdictionaries.com/media/english/uk_pron/c/cha/chanc/chance__gb_1.mp3,шанс,[tʃɑ:ns],Just give me a chance!,Дайте мне еще один шанс!
shaped,adjective,b2,https://www.oxfordlearnersdictionaries.com/media/english/uk_pron/s/sha/shape/shaped__gb_1.mp3,имеющий форму,[ʃeɪpt],,
sight,noun,b1,https://www.oxfordlearnersdictionaries.com/media/english/uk_pron/c/cit/cite_/cite__gb_2.mp3,вид,[saɪt],We lost sight of him.,Мы потеряли его из вида
aunt,noun,a1,https://www.oxfordlearnersdictionaries.com/media/english/uk_pron/a/aun/aunt_/aunt__gb_2.mp3,тетя,[ɑ::nt],Aunt Pilar is a magpie.,Тётя Пилар - сорока.
engage,verb,b2,https://www.oxfordlearnersdictionaries.com/media/english/uk_pron/e/eng/engag/engage__gb_1.mp3,участвовать,[ɪnˈɡeɪdʒ],They have to engage in courtship.,Они участвуют в ухаживаниях.
found,verb,b2,https://www.oxfordlearnersdictionaries.com/media/english/uk_pron/f/fou/found/found__gb_3.mp3,основывать,[faund],Prime4x company was found in 2005.,Компания Prime4x была основана в 2005 году.
identity,noun,b1,https://www.oxfordlearnersdictionaries.com/media/english/uk_pron/i/ide/ident/identity__gb_3.mp3,личность,[aɪˈdentɪtɪ],For forgery and identity theft?,"За подлог и ""кражу личности""?"
reader,noun,a1,https://www.oxfordlearnersdictionaries.com/media/english/uk_pron/r/rea/reade/reader__gb_1.mp3,читатель,[ˈri:də],The casual reader nods and moves along.,Случайный читатель кивает и продолжает читать.
sticky,adjective,b2,https://www.oxfordlearnersdictionaries.com/media/english/uk_pron/s/sti/stick/sticky__gb_1.mp3,липкий,[ˈstɪkɪ],"No sticky, hot, messy, awful blood.","Нет липкой, горячей жуткой крови."
portion,noun,b2,https://www.oxfordlearnersdictionaries.com/media/english/uk_pron/p/por/porti/portion__gb_1.mp3,часть,[ˈpɔ:ʃən],Export only a portion of the data,Экспорт только части данных
nuclear,adjective,b1,https://www.oxfordlearnersdictionaries.com/media/english/uk_pron/n/nuc/nucle/nuclear__gb_2.mp3,ядерный,[ˈnju:klɪə],The nuclear clock is ticking.,Ядерные часы уже тикают.
offend,verb,b2,https://www.oxfordlearnersdictionaries.com/media/english/uk_pron/o/off/offen/offend__gb_1.mp3,оскорблять,[əˈfend],“Or are happy to offend.”,"— Либо они рады тому, что кого-то оскорбили»."
channel,noun,b1,https://www.oxfordlearnersdictionaries.com/media/english/uk_pron/c/cha/chann/channel__gb_2.mp3,канал,[ˈtʃænl],Sales performance by retail channel,Эффективность продаж по каналам розничной торговли
evaluation,noun,b2,https://www.oxfordlearnersdictionaries.com/media/english/uk_pron/e/eva/evalu/evaluation__gb_1.mp3,оценка,[ɪˌvæljuˈeɪʃən],Approaching Tad for Efficiency Evaluation.,Подхожу к Теду для оценки эффективности.
prospective,adjective,c1,https://www.oxfordlearnersdictionaries.com/media/english/uk_pron/p/pro/prosp/prospective__gb_1.mp3,возможный,[prəsˈpektɪv],America also needs a strategy to respond to any prospective attacks.,США также нужна стратегия реагирования на возможные атаки.
want,verb,a1,https://www.oxfordlearnersdictionaries.com/media/english/uk_pron/w/wan/want_/want__gb_1.mp3,хотеть,[wɔnt],You want to go clubbing?,Ты хочешь затусить?
advertisement,noun,a2,https://www.oxfordlearnersdictionaries.com/media/english/uk_pron/a/adv/adver/advertisement__gb_1.mp3,реклама,[ədˈvə:tɪsmənt],An advertisement embedded inside an article.,"Реклама, встроенная в статью."
